created_at,text,in_reply_to_status_id_str,source,in_reply_to_screen_name,contributors,quoted_status_id,quote_count,reply_count,retweet_count,favorite_count,retweeted,followers_count
11/12/2017 12:32,"Today, we remember Ken Saro-Wiwa, who was killed on this day in 1995. May we never forget our heroes.",,Twitter for iPhone,,,Not Availabe,Not Availabe,Not Availabe,245,675,,
11/12/2017 12:28,"Thankfully, the PHD holders who agree to work in my businesses do not mind #smile https://t.co/OqeaMxFJjx",,Twitter for iPhone,,,9.29672E+17,Not Availabe,Not Availabe,549,605,,
11/10/2017 13:54,"Would be hard to find 3 living Nigerians who have created more private sector jobs than I have. 

But it’s also important to say that all those jobs still aren’t enough. We need our economy to encourage more entrepreneurs to create even more jobs. https://t.co/cgIJN4lFkk",,Twitter for iPhone,,,9.28221E+17,Not Availabe,Not Availabe,566,975,,
11/10/2017 13:47,Turaki Adamawa! https://t.co/z4S28R1F9A,,Twitter for iPhone,,,9.28978E+17,Not Availabe,Not Availabe,114,295,,
11/8/2017 8:48,"We must get desperate about creating more jobs, so our young people are not forced to run away from their own country.",9.28E+17,Twitter for iPhone,atiku,,Not Availabe,Not Availabe,Not Availabe,149,379,,
11/8/2017 8:46,Deeply saddened by the death of 26 Nigerian girls in the Mediterranean. I pray for strength for their families.,,Twitter for iPhone,,,Not Availabe,Not Availabe,Not Availabe,303,880,,
11/7/2017 12:51,"RT @AUNigeria: The 1,000 beneficiaries were selected &amp; trained on business development, marketing strategies, cooperative management &amp; fina…",,Twitter for iPhone,,,9.27865E+17,Not Availabe,Not Availabe,39,0,,
11/7/2017 11:49,"There’s no value in the words we speak, if we cannot help our community | @AUNigeria, UNHCR empower IDP returnees https://t.co/YOC1tdT5VP",,Twitter for iPhone,,,Not Availabe,Not Availabe,Not Availabe,105,200,,
11/7/2017 7:58,The attack on innocent people by Boko Haram Terrorists deserves continued condemnation and action. The latest attack on Adamawa is cowardly!,,Twitter for iPhone,,,Not Availabe,Not Availabe,Not Availabe,441,833,,
11/7/2017 6:20,Missionaries and volunteers have been partners for education in Nigeria for centuries. That anyone would think of hurting them is sickening.,9.28E+17,Twitter for iPhone,atiku,,Not Availabe,Not Availabe,Not Availabe,87,176,,
11/7/2017 6:18,"Saddened by the killing of Ian Squire, the British missionary by kidnappers. This barbaric event must be condemned @Number10gov @theresa_may",,Twitter for iPhone,,,Not Availabe,Not Availabe,Not Availabe,123,281,,
11/3/2017 10:01,"RT @omonlakiki: H.E. @atiku received UN Special Envoy for West Africa and the Sahel, Amb. Mohamed Ibn Chambas, at a courtesy visit. @AtikuO…",,Twitter for iPhone,,,Not Availabe,Not Availabe,Not Availabe,51,0,,
11/3/2017 8:55,"This #FakeNews is breaking across so many media channels, I’m wondering who sent it to them #Smile https://t.co/Q64ZtQ9u69",,Twitter for iPhone,,,9.2636E+17,Not Availabe,Not Availabe,415,459,,
11/3/2017 8:51,#FakeNews https://t.co/N202Qt3kmq,,Twitter for iPhone,,,9.26188E+17,Not Availabe,Not Availabe,281,281,,
11/2/2017 6:58,"Asiwaju, I’m deeply saddened by the loss of your dear son, Jide. May the Almighty console you, your wife and family. We’re praying for you.",,Twitter for iPhone,,,Not Availabe,Not Availabe,Not Availabe,440,1395,,
11/1/2017 20:40,"I’m very sure they didn’t know I was landing there from a trip abroad, right at that time when they were having a school excursion #smile https://t.co/e0ov82V20w",,Twitter for iPhone,,,Not Availabe,Not Availabe,Not Availabe,74,235,,
11/1/2017 17:51,"Children are fearless and wonderful. They saw me and started calling “Atiku!” I don’t know how they knew me, but I’m happy. https://t.co/MIeZ9950Y0",,Twitter for iPhone,,,Not Availabe,Not Availabe,Not Availabe,832,3028,,
11/1/2017 13:10,"Wishing our former VP, Dr Alex Ekwueme, good health. Get well soon.",,Twitter for iPhone,,,Not Availabe,Not Availabe,Not Availabe,222,835,,
10/30/2017 15:32,"If anything, the Adamawa Peace Initiative has shown that this is achievable. We can bring all stakeholders together, and save lives.",9.25E+17,Twitter for iPhone,atiku,,Not Availabe,Not Availabe,Not Availabe,70,172,,
10/30/2017 15:30,"The government has the responsibility of bringing stakeholders together to dialogue, punish offenders and ensuring genuine reconciliation.",9.25E+17,Twitter for iPhone,atiku,,Not Availabe,Not Availabe,Not Availabe,66,158,,
10/30/2017 15:29,It's time for regional stakeholders to dialogue &amp; address deep-rooted issues and strive for peaceful coexistence. https://t.co/Ch35Aj2md6,,Twitter for iPhone,,,Not Availabe,Not Availabe,Not Availabe,82,235,,
10/29/2017 14:17,Haha. You don’t like me too? https://t.co/Y3wsmUKQNX,,Twitter for iPhone,,,9.24641E+17,Not Availabe,Not Availabe,57,236,,
10/29/2017 14:11,"A man in Yola once told me “I don’t like you, but my son works in your factory, so I respect you”. One of the best compliments I’ve received",9.25E+17,Twitter for iPhone,atiku,,Not Availabe,Not Availabe,Not Availabe,445,762,,
10/29/2017 14:06,"The words of my first boss were true. I wasn’t paid much, but when my mother was homeless, my savings bought her a mud house to live in.",9.25E+17,Twitter for iPhone,atiku,,Not Availabe,Not Availabe,Not Availabe,147,344,,
10/29/2017 14:01,We don’t need to give free food or handouts to young Nigerians if they have jobs and can provide for themselves. #Education #Jobs,9.25E+17,Twitter for iPhone,atiku,,Not Availabe,Not Availabe,Not Availabe,129,170,,
10/29/2017 13:58,"My first boss used to say “You don’t need to like this job, but as long as it pays enough to give you dignity, everything else is surplus”.",9.25E+17,Twitter for iPhone,atiku,,Not Availabe,Not Availabe,Not Availabe,190,238,,
10/29/2017 13:53,I‘ve always said the only relevant conversation a Nigerian leader should be having with young Nigerians is “how many jobs are we creating?”,9.25E+17,Twitter for iPhone,atiku,,Not Availabe,Not Availabe,Not Availabe,110,171,,
10/29/2017 13:48,"The main objective we should focus on as a country spelled out in one tweet. Thank you, Femi! https://t.co/OxMAuQEkR9",,Twitter for iPhone,,,9.24523E+17,Not Availabe,Not Availabe,156,368,,
10/25/2017 14:28,"I celebrate HRM, Omo N'Oba N'Edo Uku Akpolokpolo, Oba Ewuare II, Oba of Benin, on the first anniversary of his coronation. Oba Ghato Kpere! https://t.co/3bT41gOMv5",,Twitter for iPhone,,,Not Availabe,Not Availabe,Not Availabe,162,638,,
10/23/2017 13:09,My heart goes out to the people of Maiduguri and families affected by the multiple bomb blasts in the city. This is heart breaking.,,Twitter for iPhone,,,Not Availabe,Not Availabe,Not Availabe,470,902,,
10/22/2017 17:09,Arsenal spelled A-T-I-K-U today. 5 goals!,,Twitter for iPhone,,,Not Availabe,Not Availabe,Not Availabe,1030,2954,,
10/21/2017 17:23,Congratulations to Cosmas Maduka on the berthing of the Ford Assembly plant. An opportunity to create more jobs. https://t.co/yVwi3vF6LT,,Twitter for iPhone,,,Not Availabe,Not Availabe,Not Availabe,478,914,,
10/19/2017 17:32,"This move shows a commitment to peace, unity and our shared belief in one Nigeria, with justice and equity for all.",9.21E+17,Twitter for iPhone,atiku,,Not Availabe,Not Availabe,Not Availabe,87,268,,
10/19/2017 17:30,I commend @NGRPresident @MBuhari for ordering payment of pensions to pardoned Biafran soldiers. It shows unity! https://t.co/sfbLvVg0fq,,Twitter for iPhone,,,Not Availabe,Not Availabe,Not Availabe,404,934,,
10/19/2017 8:16,Felix Arizugo's story is remarkable. We need to do more to keep our teachers motivated to make their jobs easier.- https://t.co/VZMHbpptnM,,Twitter for iPhone,,,Not Availabe,Not Availabe,Not Availabe,60,159,,
10/17/2017 20:33,"This is a very shameful tweet, my young friend. Children were hurt in that accident. Our only response should be sympathy. https://t.co/wNLqvyJbtF",,Twitter for iPhone,,,9.20377E+17,Not Availabe,Not Availabe,165,260,,
10/17/2017 19:29,"I read about the tanker that fell in Ehere, outside Aba with a heavy heart. I pray the children and families are ok https://t.co/a3vrgMIpU6",,Twitter for iPhone,,,Not Availabe,Not Availabe,Not Availabe,110,316,,
10/17/2017 6:52,I urge the security services to put in all resources to ensure that these killings do not reoccur and the killers are made to face justice.,9.20E+17,Twitter for iPhone,atiku,,Not Availabe,Not Availabe,Not Availabe,157,364,,
10/17/2017 6:52,The killings in Plateau state are condemnable. The avoidable death of even one Nigerian is one death too many.,,Twitter for iPhone,,,Not Availabe,Not Availabe,Not Availabe,576,1128,,
10/15/2017 19:24,Congratulations @AkwaUnited_fc for winning the #AiteoCupFinal. Also applauding @NigerTornadoes for a gam well played.,,Twitter for iPhone,,,Not Availabe,Not Availabe,Not Availabe,185,531,,
10/14/2017 11:50,"My Yoruba is not as good as it should be, considering how long I lived in the west. But I get by small small. https://t.co/1DcbpKyd2v",,Twitter for iPhone,,,9.19167E+17,Not Availabe,Not Availabe,145,517,,
10/14/2017 10:41,Good points made here by the MD of the IMF and the World Bank Group President on way forward for Nigeria -  https://t.co/B5Fi5sNoa5,,Twitter for iPhone,,,Not Availabe,Not Availabe,Not Availabe,119,218,,
10/13/2017 19:58,"I celebrate the great Owa of Ijesaland, Oba Gabriel Adekunle Aromolaran on your 80th birthday. Kabiesi Adimula, Eshin oba a j'oko pe o!",,Twitter for iPhone,,,Not Availabe,Not Availabe,Not Availabe,278,984,,
10/13/2017 7:18,"Dear Kingsley, if sharing valuable information about a dangerous viral disease to save lives is politics, then let’s play more politics. https://t.co/8GE5OfdpVf",,Twitter for iPhone,,,9.18735E+17,Not Availabe,Not Availabe,430,914,,
10/12/2017 11:03,"We defeated Ebola together, we can defeat monkeypox together. https://t.co/5LqmvHvWFr",,Twitter for iPhone,,,Not Availabe,Not Availabe,Not Availabe,424,1009,,
10/11/2017 17:42,"Evans, do you know that in many parts of Nigeria/Africa, girls are not allowed to finish school? This is bad for us as a country. https://t.co/09QOEyHj88",,Twitter for iPhone,,,9.18168E+17,Not Availabe,Not Availabe,143,293,,
10/11/2017 16:31,"When we don’t educate girls, we lose 50% of our high value workforce, 50% of intellectual resources. It’s unacceptable. #DayoftheGirl https://t.co/hw0T2Mrdik",9.18E+17,Twitter for iPhone,atiku,,Not Availabe,Not Availabe,Not Availabe,97,259,,
10/11/2017 15:28,"When we educate a girl, we educate a nation! If I have to leave one legacy, this will be it. #DayOfTheGirl https://t.co/0hLkq7rFKe",,Twitter for iPhone,,,Not Availabe,Not Availabe,Not Availabe,456,1074,,
10/11/2017 10:40,This is a very good move. Our children need to know history - Nigeria reintroduces History in schools from 2018/2019 https://t.co/bc8BR2lAAc,,Twitter for iPhone,,,Not Availabe,Not Availabe,Not Availabe,177,360,,
10/10/2017 20:28,@Malala @UniofOxford @AUNigeria It’s great to cheer @Malala &amp; our #ChibokGirls in @AUNigeria. They represent victory against ideologies that don’t want education for girls,9.18E+17,Twitter for iPhone,atiku,,Not Availabe,Not Availabe,Not Availabe,53,104,,
10/10/2017 18:56,"Today, @Malala started @UniofOxford. This same year, our first set of #ChibokGirls started in @AUNigeria. Victories for girls’ education https://t.co/NOudWy8hxy",,Twitter for iPhone,,,Not Availabe,Not Availabe,Not Availabe,368,582,,
10/10/2017 7:28,"An amazing story and a victory for education, especially girl child education, all over the world. https://t.co/AUOH7ZF4xs",,Twitter for iPhone,,,9.17414E+17,Not Availabe,Not Availabe,126,285,,
10/9/2017 18:09,I'm saddened to learn of the passing of Gen. Victor Malu. He was a brave soldier and a true Nigerian hero.,,Twitter for iPhone,,,Not Availabe,Not Availabe,Not Availabe,214,698,,
10/8/2017 19:34,RT @woleotegbade: @atiku @TospalSix How many jobs have u created for the people of adamawa?,,Twitter for iPhone,,,Not Availabe,Not Availabe,Not Availabe,14,0,,
10/8/2017 15:57,"Good weekend to be Nigerian! Russia, Poland, everywhere we’re winning. Well done Aruna Quadiri! https://t.co/nl62df6s1t",,Twitter for iPhone,,,9.17053E+17,Not Availabe,Not Availabe,281,527,,
10/8/2017 14:15,RT @Okagbare01: I cannot come and Carry last when Norway is close to Russia @atiku I will be there #ReadyForRussia #AtikuChallenge. https:/…,,Twitter for iPhone,,,Not Availabe,Not Availabe,Not Availabe,28,0,,
10/8/2017 14:08,"Well done, Alex! We are all so proud of you and the team! Thank you! https://t.co/eK4te5j0qC",,Twitter for iPhone,,,9.16774E+17,Not Availabe,Not Availabe,105,298,,
10/8/2017 13:30,RT @tee_kay3: Russia all the way....C'mon Super Eagles @atiku ...#TheAtikuChallenge https://t.co/v6LhX3WvRL,,Twitter for iPhone,,,Not Availabe,Not Availabe,Not Availabe,8,0,,
10/8/2017 13:08,RT @janeyjil: @Chydee @atiku shift lemmi tag along #theAtikuChallenge 😂 https://t.co/uaSo3zEy3r,,Twitter for iPhone,,,Not Availabe,Not Availabe,Not Availabe,25,0,,
10/8/2017 10:32,Congratulations Michael. https://t.co/jcjUjPpAXJ,,Twitter for iPhone,,,Not Availabe,Not Availabe,Not Availabe,56,202,,
10/8/2017 10:27,"Thank you for all the support for the Super Eagles. Russia, we are coming #ReadyForRussia #AtikuChallenge https://t.co/fBPnrfTz3Z",,Twitter for iPhone,,,9.16723E+17,Not Availabe,Not Availabe,149,468,,
10/8/2017 7:54,RT @mukhtaaru: Defying the cool on the back of Eagle #ReadyforRussia @atiku https://t.co/5YijNdnwJS,,Twitter for iPhone,,,Not Availabe,Not Availabe,Not Availabe,12,0,,
10/7/2017 21:54,RT @fasthebaker: Russia we are coming #Atikuchallenge @atiku I'm with you sir https://t.co/FY03SkRRp5,,Twitter for iPhone,,,Not Availabe,Not Availabe,Not Availabe,17,0,,
10/7/2017 21:37,RT @Talk2Capt: They say Russia  is cold but we are coming 🔥 #Russia2018 #Atikuchallenge @atiku @thenff https://t.co/RfQjPVKapQ,,Twitter for iPhone,,,Not Availabe,Not Availabe,Not Availabe,16,0,,
10/7/2017 21:37,RT @Tutsy22: @atiku Issa nobody can leave me behind. Oya join #AtikuChallenge 😂😂😂 https://t.co/bBgrGu6QOT,,Twitter for iPhone,,,Not Availabe,Not Availabe,Not Availabe,45,0,,
10/7/2017 21:36,"RT @Adamss_babs: @atiku All set,No matter how cold, Nigeria's worth bearing ...#readyforrussia https://t.co/AF9wEjLN1R",,Twitter for iPhone,,,Not Availabe,Not Availabe,Not Availabe,5,0,,
10/7/2017 21:36,RT @favourdesimhi: @atiku I am ready to go with you sir #Atikuchallenge #Russia2018 https://t.co/gAtENSTYdV,,Twitter for iPhone,,,Not Availabe,Not Availabe,Not Availabe,10,0,,
10/7/2017 21:35,RT @BenFidelis: I'm up for it. My days on the highest plateau in Nigeria - the Mambilla Plateau - awesome! Russia Expect me too. #TheAtikuC…,,Twitter for iPhone,,,Not Availabe,Not Availabe,Not Availabe,14,0,,
10/7/2017 21:34,"RT @Seyiboyadebayo: @atiku I are going with you, I don't care even if is just lapping #ReadyForRussia. #TheAtikuChallenge https://t.co/ESUi…",,Twitter for iPhone,,,Not Availabe,Not Availabe,Not Availabe,9,0,,
10/7/2017 21:33,RT @openiyianu: @atiku #Russia is cold but we are coming in 2018. #ReadyforRussia https://t.co/uwnIQuJjCk,,Twitter for iPhone,,,Not Availabe,Not Availabe,Not Availabe,8,0,,
10/7/2017 21:28,RT @Jidenna: 🇳🇬 Now they need to put us back in FIFA video games! 🇳🇬 #WorldCup 2018 🇳🇬 #SuperEagles @thenff https://t.co/mQmRlEWuzK,,Twitter for iPhone,,,Not Availabe,Not Availabe,Not Availabe,6218,0,,
10/7/2017 21:27,"RT @benmurraybruce: Russia, expect my son and I too #TheAtikuChallenge! https://t.co/gDw2rY9Xqh",,Twitter for iPhone,,,Not Availabe,Not Availabe,Not Availabe,260,0,,
10/7/2017 21:26,RT @Rotleo3819: @atiku #readyforrussia Even if Russia is a freezer ..We are coming... https://t.co/U9mS3kuGgJ,,Twitter for iPhone,,,Not Availabe,Not Availabe,Not Availabe,8,0,,
10/7/2017 21:22,RT @sar_GENT: #AtikuChallenge #SuperEagles https://t.co/bfYnZ8Wqrr,,Twitter for iPhone,,,Not Availabe,Not Availabe,Not Availabe,5,0,,
10/7/2017 21:22,RT @sisiese: #AtikuChallenge #russia2018 😁 https://t.co/Sq7p9TdBfl,,Twitter for iPhone,,,Not Availabe,Not Availabe,Not Availabe,3,0,,
10/7/2017 21:22,"RT @btinaudu: @sherriekhay &amp; @btinaudu are ready for #Russia2018 , cold or no cold we are on fire #Nigeria 

@atiku 
#AtikuChallenge https:…",,Twitter for iPhone,,,Not Availabe,Not Availabe,Not Availabe,8,0,,
10/7/2017 21:20,RT @Iamfemijoseph: @atiku @james_abati Am going with you. #ReadyForRussia #AtikuChallenge https://t.co/KEfhm20y0K,,Twitter for iPhone,,,Not Availabe,Not Availabe,Not Availabe,2,0,,
10/7/2017 21:19,"RT @elisinhu: @atiku 
Russia hear we come 
Will miss Yola heat though 
#Atikuchallenge https://t.co/VkqOcfMYEg",,Twitter for iPhone,,,Not Availabe,Not Availabe,Not Availabe,4,0,,
10/7/2017 21:18,"RT @TexTheLaw: Okay o, since we are doing the #AtikuChallenge, I'm also ready for Russia 2018 https://t.co/mol48kigiY",,Twitter for iPhone,,,Not Availabe,Not Availabe,Not Availabe,19,0,,
10/7/2017 21:18,RT @njacob_z: @Chydee @atiku ready for Russia... #atikuchallenge https://t.co/uOL6RDrfiv,,Twitter for iPhone,,,Not Availabe,Not Availabe,Not Availabe,14,0,,
10/7/2017 21:18,RT @renoomokri: Me too I am #ReadyforRussia with the #AtikuChallenge! https://t.co/8TTvdBar31,,Twitter for iPhone,,,Not Availabe,Not Availabe,Not Availabe,52,0,,
10/7/2017 19:53,RT @Kaybenjamine: @atiku I'm also warming up for Russia. #TheAtikuChallenge. Cold or hot I must go. https://t.co/LnWrORADxw,,Twitter for iPhone,,,Not Availabe,Not Availabe,Not Availabe,31,0,,
10/7/2017 19:51,RT @KULKAT_: @Chydee @atiku Hope I get to tag along too 😭Russia here we come. #TheAtikuChallenge https://t.co/eYUSDcrg9u,,Twitter for iPhone,,,Not Availabe,Not Availabe,Not Availabe,13,0,,
10/7/2017 19:35,RT @MrAbdul112: @atiku No matter how cold the weather we are going!! https://t.co/xBm35ZNyj0,,Twitter for iPhone,,,Not Availabe,Not Availabe,Not Availabe,12,0,,
10/7/2017 19:34,"RT @sleeky4: @atiku Russia we coming...cold got nothing on us
#russia2018
#ATIKUCHALLENGE https://t.co/1rs3lmmZJY",,Twitter for iPhone,,,Not Availabe,Not Availabe,Not Availabe,32,0,,
10/7/2017 19:34,"RT @bubblybenz: Russia if you like be freezing, we are smilling ready. Lets go 9ja. Flying with HE @atiku to the world cup. #ReadyForRussia…",,Twitter for iPhone,,,Not Availabe,Not Availabe,Not Availabe,11,0,,
10/7/2017 19:13,RT @zinazee20: Nigerians we are going to Russia #ReadyForRussia #TheAtikuChallenge https://t.co/60Gv4QZPGl,,Twitter for iPhone,,,Not Availabe,Not Availabe,Not Availabe,37,0,,
10/7/2017 19:00,RT @Chydee: @atiku We are going with you. #ReadyForRussia. #TheAtikuChallenge ❄️ https://t.co/gSrppnhwah,,Twitter for iPhone,,,Not Availabe,Not Availabe,Not Availabe,93,0,,
10/7/2017 18:44,"RT @Xchange1: They said Russia is cold. I am #ReadyforRussia
Cc: @atiku @Omojuwa @thenff https://t.co/lIcHWT02js",,Twitter for iPhone,,,Not Availabe,Not Availabe,Not Availabe,10,0,,
10/7/2017 18:23,Yes! Let’s show support for the Super Eagles with this new hash tag #ReadyForRussia https://t.co/VvvLZyXUht,,Twitter for iPhone,,,Not Availabe,Not Availabe,Not Availabe,96,218,,
10/7/2017 17:54,They say Russia is cold. We are still coming! Haha! Congratulations to the Super Eagles and all Nigerians! #NGAZAM https://t.co/RX64q4PUcR,,Twitter for iPhone,,,Not Availabe,Not Availabe,Not Availabe,3279,4724,,
10/7/2017 17:35,Jay Jay Okocha’s nephew. Arsenal player. Iwobi is making Nigeria proud.,,Twitter for iPhone,,,Not Availabe,Not Availabe,Not Availabe,1897,3387,,
10/7/2017 15:41,These children. I’m already warming up for Russia anyway #smile #NGRZAM https://t.co/jcIgphgrHX,,Twitter for iPhone,,,Not Availabe,Not Availabe,Not Availabe,273,549,,
10/7/2017 6:55,Football certainly unifies all Nigerians. Best of luck to the Super Eagles in the match against Zambia #WinnerOhOhOh,,Twitter for iPhone,,,Not Availabe,Not Availabe,Not Availabe,430,1151,,
10/6/2017 6:57,"We all share a responsibility to share correct information on the monkeypox disease. Just like we fought Ebola, we will fight this and win.",9.16E+17,Twitter for iPhone,atiku,,Not Availabe,Not Availabe,Not Availabe,128,258,,
10/6/2017 6:55,"I’m urging the FG, Bayelsa State government, and response agencies to cooperate to enlighten citizens, and fight the outbreak.",9.16E+17,Twitter for iPhone,atiku,,Not Availabe,Not Availabe,Not Availabe,106,195,,
10/6/2017 6:55,"The discovery of monkeypox in Bayelsa is alarming and should be seen as a national emergency, to halt its spread.",,Twitter for iPhone,,,Not Availabe,Not Availabe,Not Availabe,578,678,,
10/5/2017 14:00,"I’ll never forget my Geography teacher, Mr. Iyorkur, and all he did to help me follow a sound path. God bless all teachers #WorldTeachersDay",9.16E+17,Twitter for iPhone,atiku,,Not Availabe,Not Availabe,Not Availabe,129,484,,
10/5/2017 13:57,Teachers are the ladders we climbed to get to where we are. They are human fountains of knowledge. I celebrate them this #WorldTeachersDay.,,Twitter for iPhone,,,Not Availabe,Not Availabe,Not Availabe,613,1496,,
10/3/2017 10:58,"My condolences to the family of AVM Mukhtar Muhammed (rtd), former military governor of old Kaduna State (1977-1978) https://t.co/47Tqsljj1h",,Twitter for iPhone,,,Not Availabe,Not Availabe,Not Availabe,94,217,,
10/3/2017 8:14,We are not growing if our population is growing faster than our economy. https://t.co/yO1dm0kD6T,,Twitter for iPhone,,,Not Availabe,Not Availabe,Not Availabe,447,759,,
10/2/2017 17:59,My prayers go out to President @realDonaldTrump and the American people over the deaths in Vegas. May God bring peace to our world.,,Twitter for iPhone,,,Not Availabe,Not Availabe,Not Availabe,173,706,,
10/2/2017 17:10,"We are not where we used to be, but we must keep making even more progress. #Independence https://t.co/V2FMo0D9VN",,Twitter for iPhone,,,Not Availabe,Not Availabe,Not Availabe,86,266,,
10/2/2017 9:59,"RT @AtikuOrg: We've seen this flying around. It's fake. Possibly photoshop. @Atiku owns a feed factory, employing hundreds, not rice. https…",,Twitter for iPhone,,,Not Availabe,Not Availabe,Not Availabe,157,0,,
10/1/2017 6:49,Happy Independence Day Nigeria https://t.co/biq4TZ8NfX,,Twitter for iPhone,,,Not Availabe,Not Availabe,Not Availabe,160,499,,
9/30/2017 12:43,Nigeria's status quo works for the elite (including myself). It must be disrupted to work for everyday citizens. https://t.co/ocUKMPjnMw,,Twitter for iPhone,,,Not Availabe,Not Availabe,Not Availabe,861,1357,,
9/28/2017 17:42,Our Cashew nuts quality now ranks high in the world and output soars by 43%. Shows our economy can be diversified. https://t.co/mwgRyx3RDh,,Twitter for iPhone,,,Not Availabe,Not Availabe,Not Availabe,316,560,,
9/28/2017 14:53,We should be mindful of fake news and all media should verify stories before publishing.,,Twitter for iPhone,,,Not Availabe,Not Availabe,Not Availabe,328,825,,
9/27/2017 18:42,"RT @AtikuOrg: Dear @vanguardngrnews, this fake news from your platform amounts to slander. Our legal team will be writing you shortly. http…",,Twitter for iPhone,,,Not Availabe,Not Availabe,Not Availabe,65,0,,
9/27/2017 18:29,"This is the most disrespectful act I have seen from a news organization. The news is fake, and my lawyers will be writing to Vanguard https://t.co/W5impkkLFY",,Twitter for iPhone,,,Not Availabe,Not Availabe,Not Availabe,347,275,,
9/27/2017 12:52,"Bishop David Oyedepo has contributed more than most to deepening faith, education and culture in Nigeria. I wish him a happy 63rd birthday.",,Twitter for iPhone,,,Not Availabe,Not Availabe,Not Availabe,803,1744,,
9/26/2017 16:42,"I agree with Bauchi State Governor Abubakar @GovMAA, that our youths should have priority in a restructured Nigeria with true federalism.",9.13E+17,Twitter for iPhone,atiku,,Not Availabe,Not Availabe,Not Availabe,121,274,,
9/26/2017 16:42,I am happy to see Northern States backing the call for restructuring starting with the devolution of powers.,,Twitter for iPhone,,,Not Availabe,Not Availabe,Not Availabe,526,1121,,
9/26/2017 7:29,"In 1999, Nigeria had less than 500,000 telephone lines. Innovation can fundamentally change our economy. https://t.co/3SdrIETBeU",,Twitter for iPhone,,,Not Availabe,Not Availabe,Not Availabe,601,1023,,
9/24/2017 18:41,We're late. But late is better than never. Never would be catastrophic for our future. The time is now #diversify #restructure #economy https://t.co/2LTXmulS1o,,Twitter for iPhone,,,9.11953E+17,Not Availabe,Not Availabe,218,361,,
9/24/2017 6:41,"Congratulations to the government and people of Kastina State, including @NGRPresident, on the 30th anniversary of the state's creation!",9.12E+17,Twitter for iPhone,atiku,,Not Availabe,Not Availabe,Not Availabe,116,355,,
9/23/2017 20:48,"Today, I join other Nigerians in celebrating our dear Akwa Ibom State. Happy 30th anniversary! Akwa Ibom isongo o! #OrangeSeptember",,Twitter for iPhone,,,Not Availabe,Not Availabe,Not Availabe,313,917,,
9/23/2017 7:14,"""The treasure in the minds of our people is more important than oil"" https://t.co/TGK1QAX9VM",9.11E+17,Twitter for iPhone,atiku,,Not Availabe,Not Availabe,Not Availabe,278,642,,
9/21/2017 18:42,"""Oil is not Nigeria's biggest asset. Nigerians are."" https://t.co/bpJ7E3FJz6",,Twitter for iPhone,,,Not Availabe,Not Availabe,Not Availabe,1257,2209,,
9/21/2017 12:10,"As we mark the new year in the Islamic calendar, I wish the Muslim Ummah and the #nation a happy Hijrah. May Allah (SWT) bless this Hijrah.",,Twitter for iPhone,,,Not Availabe,Not Availabe,Not Availabe,491,991,,
9/20/2017 17:06,I am inspired by the bravery on display in Mexico as they unite to overcome this act of nature. May God be with them at this trying time.,9.11E+17,Twitter for iPhone,atiku,,Not Availabe,Not Availabe,Not Availabe,67,163,,
