created_at,text,in_reply_to_status_id_str,source,in_reply_to_screen_name,contributors,quoted_status_id,quote_count,reply_count,retweet_count,favorite_count,retweeted,followers_count
12/19/2019 8:20,"On behalf of my family, I wish @bukolasaraki a very happy birthday. May Allah grant you many more years in good health and continued service to Nigeria. -AA https://t.co/YYHcR3AaSX",,Twitter for iPhone,,,Not Availabe,Not Availabe,Not Availabe,1227,10787,,
12/15/2019 16:08,How sweet of my grandchildren to bring me a belated birthday cake. #smiles https://t.co/gjak4bGmdt,,Twitter for iPhone,,,Not Availabe,Not Availabe,Not Availabe,943,11928,,
12/15/2019 7:53,"On behalf of my family, I thank those present and also well-wishers for their prayers at the Wedding Fatiha of my dear son, @HHMustaphaAA and his wife, Afrah El-Nafaty. May Allah bless you all for making it a truly special day for me and my family. -AA https://t.co/a6xniZXW1l",,Twitter for iPhone,,,Not Availabe,Not Availabe,Not Availabe,714,6539,,
12/13/2019 15:51,I congratulate @BorisJohnson on his reelection as Prime Minister of the United Kingdom. -AA,,Twitter for iPhone,,,Not Availabe,Not Availabe,Not Availabe,639,5373,,
12/10/2019 9:44,"#HumanRightsDay means that the global human community abhors dictatorial regimes. To celebrate this day therefore, I again call for the immediate release of all prisoners of good conscience in Nigeria and demand a jettisoning of repressive legislation against free speech - AA.",,Twitter for iPhone,,,Not Availabe,Not Availabe,Not Availabe,822,3380,,
12/9/2019 10:25,"On behalf of my family and well-wishers, I wish General T.Y Danjuma, a foremost officer and business tycoon a happy 82nd birthday anniversary. God bless you. Best wishes. -AA",,Twitter for iPhone,,,Not Availabe,Not Availabe,Not Availabe,502,4790,,
12/7/2019 22:21,Great to see @anthonyfjoshua reclaim the championship. A good fight. -AA https://t.co/CZCJWC9Cnr,,Twitter for iPhone,,,Not Availabe,Not Availabe,Not Availabe,2530,19433,,
12/7/2019 17:53,Grandpa duties. #smiles https://t.co/Z6gQ9ePGM9,,Twitter for iPhone,,,Not Availabe,Not Availabe,Not Availabe,2817,26024,,
12/6/2019 16:15,To keep Nigeria a democracy is the paramount duty of all concerned stakeholders. Please speak up against this tyranny and side with the Nigerian people.,1.20E+18,Twitter for iPhone,atiku,,Not Availabe,Not Availabe,Not Availabe,967,2684,,
12/6/2019 16:15,"Without the rule of law, there can be no rule at all. Power in Nigeria still flows from the people, not from the barrel of a gun. I call on all men and women of goodwill not to keep quiet or sit on the fence at times like this.",1.20E+18,Twitter for iPhone,atiku,,Not Availabe,Not Availabe,Not Availabe,997,2492,,
12/6/2019 16:15,We cannot have a situation where our government is quick to obey foreign court orders and even quicker to disobey domestic court orders. This is symptomatic of a mindset that is servile to foreign powers and brutal to Nigerians.,1.20E+18,Twitter for iPhone,atiku,,Not Availabe,Not Availabe,Not Availabe,815,1950,,
12/6/2019 16:15,"I further call for all law enforcement agencies in Nigeria to immediately respect not just the court order made by Justice Ojukwu, but the order of any court in Nigeria, on any detainee, be it Omoyele Sowore, Sambo Dasuki or Ibrahim Zakzaky, among others.",1.20E+18,Twitter for iPhone,atiku,,Not Availabe,Not Availabe,Not Availabe,846,1959,,
12/6/2019 16:15,"I call for an immediate inquiry to be set up to identify those responsible for the maltreatment meted out to Justice Ijeoma Ojukwu and the desecration of her court, and indeed the Nigerian judiciary. They must be sanctioned to the highest extent permissible by our laws.",1.20E+18,Twitter for iPhone,atiku,,Not Availabe,Not Availabe,Not Availabe,739,1748,,
12/6/2019 16:15,"Nigeria is not a dictatorship. We are a democracy, no matter how inconvenient this fact is to the powers that have forced themselves on us.",1.20E+18,Twitter for iPhone,atiku,,Not Availabe,Not Availabe,Not Availabe,971,2164,,
12/6/2019 16:15,"Never in the history of Nigerian democracy has a judge been treated in such a disdainful and brazen attack on not just her person and office, but on the entire judiciary. This is unacceptable. It is a rape on the sanctity of the court.",1.20E+18,Twitter for iPhone,atiku,,Not Availabe,Not Availabe,Not Availabe,1141,2522,,
12/6/2019 16:15,"Today, I am in extreme anguish of spirit having watched the unfortunate drama that played itself out at the Federal High Court sitting in Abuja, in which agents of the state caused a commotion in court in order to frustrate a judgment of a court of competent authority.",,Twitter for iPhone,,,Not Availabe,Not Availabe,Not Availabe,5704,15793,,
12/5/2019 16:44,"Today, in the interest of the nation, I joined fellow compatriots at the public hearing of the @NGRSenate Committee on Tertiary Institutions and TETFUND, to advocate for the conversion of Modibbo Adama University of Technology (MAUTech) Yola, to a multi-disciplinary institution. https://t.co/ZlFu9LvQGL",,Twitter for iPhone,,,Not Availabe,Not Availabe,Not Availabe,842,4811,,
12/5/2019 16:39,"Dame Titilayo Ajanaku was my longstanding political associate. Unwavering in her commitment to democracy. The first local government chairwoman in Nigeria, politically savvy, urbane and humane. She will be sorely missed. May her soul rest in peace. -AA https://t.co/QPISx3SqrB",,Twitter for iPhone,,,Not Availabe,Not Availabe,Not Availabe,346,2479,,
12/1/2019 12:56,"Ahmed Jarma was the pioneer MD of Adama Beverages Ltd. Until his death this morning; he was the Chairman, North East branch of Manufacturers Association of Nigeria. I commiserate with his family and friends. May Allah forgive his sins and grant him Aljannah Firdaus. -AA",,Twitter for iPhone,,,Not Availabe,Not Availabe,Not Availabe,567,4234,,
12/1/2019 12:43,"For the full text of my speech at the 14th Founders’ Day Ceremony of the American University of Nigeria, @AUNigeria, see https://t.co/rlEK0q7Cj5 https://t.co/C1pyb7VaMt",,Twitter for iPhone,,,Not Availabe,Not Availabe,Not Availabe,126,668,,
11/30/2019 15:52,"RT @AUNigeria: HAPPENING NOW: AUN Founder's Day 2019. You are all welcome to this special occasion.

Watch here: https://t.co/W6tXmUQ6oD ht…",,Twitter for iPhone,,,Not Availabe,Not Availabe,Not Availabe,63,0,,
11/20/2019 7:00,"Happy 62nd birthday, Dr Goodluck Jonathan, @GEJonathan - an evergreen face of democracy, peace and freedom.

I wish you continued good health and wisdom. -AA https://t.co/ttgrLcCoJN",,Twitter for iPhone,,,Not Availabe,Not Availabe,Not Availabe,2509,17668,,
11/19/2019 14:19,"Umar Pariya was much more than a longstanding aide to me; he was incredibly loyal and qualified as a member of my family. He will be missed. May Allah comfort his family, forgive his sins and grant him AlJannah Firdaus. Ameen. https://t.co/pdLkcmkjYw",,Twitter for iPhone,,,Not Availabe,Not Availabe,Not Availabe,1580,10871,,
10/30/2019 15:50,"I was a democrat, I am a democrat, and I will always continue to be a democrat. May God bless Nigeria. -AA",1.19E+18,Twitter Web App,atiku,,Not Availabe,Not Availabe,Not Availabe,970,4158,,
10/30/2019 15:50,"This is not a time for too many words. It will suffice for me to remind Nigeria of this - we are an independent nation and we are the architects of our fate. If we do not build a free Nigeria, we may end up destroying her, and God forbid that that should be the case.",1.19E+18,Twitter Web App,atiku,,Not Availabe,Not Availabe,Not Availabe,585,2117,,
10/30/2019 15:50,"To those who think they have broken my spirit, I am sorry to disappoint you. I am too focused on Nigeria to think about myself. I gave up that luxury twenty years ago. The question is not if I am broken. The question is if Nigeria is whole?",1.19E+18,Twitter Web App,atiku,,Not Availabe,Not Availabe,Not Availabe,650,1985,,
10/30/2019 15:50,"Two and a half millennia ago, Sophocles said “If we are to keep our democracy, there must be one commandment: “Thou shalt not ration justice.” Nigeria will do well to observe this warning.",1.19E+18,Twitter Web App,atiku,,Not Availabe,Not Availabe,Not Availabe,469,1380,,
10/30/2019 15:50,"One man, one woman, one youth, one vote, should be the only way to make gains in a democracy. And when that is thwarted, the clock starts to tick.",1.19E+18,Twitter Web App,atiku,,Not Availabe,Not Availabe,Not Availabe,407,1261,,
10/30/2019 15:50,"In a democracy, you need a strong judiciary, a free press and an impartial electoral umpire. Nigeria has none of those three elements as at today.",1.19E+18,Twitter Web App,atiku,,Not Availabe,Not Availabe,Not Availabe,639,1574,,
10/30/2019 15:50,"When democracy is rolled back, the economy, the society and the judiciary will not be far behind. Today, the nail has been put on the coffin and the gains we collectively made since 1999 are evaporating, and a requiem is at hand.",1.19E+18,Twitter Web App,atiku,,Not Availabe,Not Availabe,Not Availabe,416,1226,,
10/30/2019 15:50,"Can Nigeria continue like this? Recently, former United States Assistant Secretary of State for Africa, Linda Thomas-Greenfield, averred that Nigeria had rolled back the democratic gains she made in 2015.",1.19E+18,Twitter Web App,atiku,,Not Availabe,Not Availabe,Not Availabe,432,1275,,
10/30/2019 15:50,"The Nigerian judiciary, just like every estate of our realm, has been sabotaged &amp; undermined by an overreaching and dictatorial cabal, who have undone almost all the democratic progress the @OfficialPDPNig and its administrations nurtured for sixteen years, up until 2015.",1.19E+18,Twitter Web App,atiku,,Not Availabe,Not Availabe,Not Availabe,485,1394,,
10/30/2019 15:50,"I thank all Nigerians who have stayed the course since the commencement of trial in the petition on the February 23 presidential election.
 
The judgement is part of democratic challenges we must face as a nation.",1.19E+18,Twitter Web App,atiku,,Not Availabe,Not Availabe,Not Availabe,403,1489,,
10/30/2019 15:50,"Whether justice was done, is left to the Nigerian people to decide. As a democrat, I fought a good fight for the Nigerian people. I will keep on fighting for Nigeria and for democracy, and also for justice.",1.19E+18,Twitter Web App,atiku,,Not Availabe,Not Availabe,Not Availabe,450,1678,,
10/30/2019 15:50,"While I believe that only God is infallible everywhere, and only Nigerians are infallible in our democracy, I must accept that the judicial route I chose to take, as a democrat, has come to a conclusion.",1.19E+18,Twitter Web App,atiku,,Not Availabe,Not Availabe,Not Availabe,451,1575,,
10/30/2019 15:50,"It is said that the Supreme Court is not final because it is infallible, but that it is infallible because it is final.",,Twitter Web App,,,Not Availabe,Not Availabe,Not Availabe,2914,10832,,
10/29/2019 13:00,"RT @omonlakiki: Twenty years ago, Women Trafficking &amp; Child Labour Eradication Foundation (WOTCLEF) was founded by Hajiya Titi Amina Abubak…",,Twitter for iPhone,,,Not Availabe,Not Availabe,Not Availabe,61,0,,
10/28/2019 17:35,"On behalf of my family, I express my deepest condolences to the Tafawa Balewa family over the loss of Hajiya Jummai Aishatu Abubakar, the last surviving wife of the first Prime Minister of independent Nigeria. May Allah forgive her sins and grant her Aljannah Firdaus. Ameen. -AA",,Twitter for iPhone,,,Not Availabe,Not Availabe,Not Availabe,813,6485,,
10/27/2019 16:11,"The Nigerian spirit has seen us as a nation turn adversity into advantage. We did it with the Flying Eagles against the defunct USSR under-20 team with a 4-0 come-back victory in Dammam, Saudi Arabia in 1989. We did it again yesterday. Congratulations, Golden Eaglets. -AA",,Twitter for iPhone,,,Not Availabe,Not Availabe,Not Availabe,529,3903,,
10/27/2019 9:59,"On behalf of my family, I wish Gov Ahmadu Fintiri a joyous birthday. It is my prayer that Allah grants him many more years in good health, vitality and wisdom in the service of Adamawa State. -AA https://t.co/7tEpBGFjkS",,Twitter for iPhone,,,Not Availabe,Not Availabe,Not Availabe,407,3876,,
10/24/2019 10:21,"RT @omonlakiki: Emmanuel Kwache, veteran journalist &amp; pioneer staff of Atiku Media Office was loyal, resourceful &amp; personable. On behalf of…",,Twitter for iPhone,,,Not Availabe,Not Availabe,Not Availabe,28,0,,
10/19/2019 10:10,"My family and I, celebrate General Yakubu Gowon, on the occasion of his 85th birthday. May God in His infinite wisdom bless you now and always and may He grant you more years of meritorious service to a grateful nation. -AA",,Twitter for iPhone,,,Not Availabe,Not Availabe,Not Availabe,705,6888,,
10/18/2019 8:17,"Thanks, Paul, but I'll prefer to start local #smiles. Also, happy birthday to you. https://t.co/fe2RtopSFf",,Twitter for iPhone,,,1.1851E+18,Not Availabe,Not Availabe,577,3355,,
10/17/2019 7:15,"We've had many preventable fuel tanker tragedies. I received with sadness, reports of a tanker explosion in Onitsha, Anambra State, which caused massive destruction to lives and properties in Ochanja Market area. My prayers and thoughts are with the families of the affected. -AA",,Twitter for iPhone,,,Not Availabe,Not Availabe,Not Availabe,1608,8156,,
10/16/2019 12:52,"It is not only desirable for us to promote mass food production, food security and large-scale commercial agricultural production. One thing I hold dearest and always done is ensure Nigerians have jobs and an income to buy food to feed their families. #ZeroHunger #WorldFoodDay",,Twitter for iPhone,,,Not Availabe,Not Availabe,Not Availabe,1297,6830,,
10/11/2019 18:00,"The girl child is a prized asset that should be nurtured to fruition. On this #DayofTheGirl, I call for concerted effort to eliminate all obstacles, including the right to education that infringes on the rights of the #GirlChild to achieve their full potentials.",,Twitter for iPhone,,,Not Availabe,Not Availabe,Not Availabe,520,2807,,
10/11/2019 13:35,"Inherent in the emergence of Ethiopian PM Abiy Ahmed as the 2019 Nobel Peace Prize winner is a huge lesson for leadership in our nation, in that: reconciliation, solidarity and social justice pays. Congratulations, PM @AbiyAhmedAli. -AA.",,Twitter for iPhone,,,Not Availabe,Not Availabe,Not Availabe,516,2929,,
10/10/2019 8:40,"I welcome the reintroduction of the Anti-Sexual Harassment Bill, a carryover from the 8th @NGRSenate. I hope that it will be one among several interventions in addressing the #SexForGrades scourge and in ensuring that our campuses are rid of predators.-AA
https://t.co/qxxvdkKTFT",,Twitter for iPhone,,,Not Availabe,Not Availabe,Not Availabe,674,2562,,
10/7/2019 12:17,"As a society, we cannot allow a trend that is psychologically abusive to young women to thrive. In fact, that’s a direct opposite of what a sound educational system represents. - AA",1.18E+18,Twitter for iPhone,atiku,,Not Availabe,Not Availabe,Not Availabe,300,958,,
10/7/2019 12:17,"I have just read the story on #SexForGrades across public tertiary institutions in many West African countries. This is unacceptable, and requires systemic strategies to put a deterrence to such behaviour.

https://t.co/uBEOHBXKEd",,Twitter for iPhone,,,Not Availabe,Not Availabe,Not Availabe,1968,4984,,
9/30/2019 7:51,And it is on this note that I wish all Nigerians a happy Independence Day. May God bless all of us and may God bless Nigeria. -AA,1.18E+18,Twitter Web App,atiku,,Not Availabe,Not Availabe,Not Availabe,333,1655,,
9/30/2019 7:51,"And to ensure that this becomes the case, we all have a duty to support and defend the Constitution of the Federal Republic of Nigeria against all enemies, foreign and domestic. And this we must do, so help us God.",1.18E+18,Twitter Web App,atiku,,Not Availabe,Not Availabe,Not Availabe,280,1092,,
9/30/2019 7:51,"Nigeria belongs to all of us and we all have a role to play in making our nation great. Nigeria should be the beacon of hope, democracy and freedom, to not only the African continent but to the black diaspora the world over.",1.18E+18,Twitter Web App,atiku,,Not Availabe,Not Availabe,Not Availabe,249,802,,
9/30/2019 7:51,"You see, when we put Nigeria first, we not only revive the Nigerian Dream, we also revive Unity &amp; Faith, Peace &amp; Progress, which were the ideals our founding fathers had in mind when they came together to put forward this new &amp; independent nation 59 years ago on October 1, 1960.",1.18E+18,Twitter Web App,atiku,,Not Availabe,Not Availabe,Not Availabe,240,759,,
9/30/2019 7:51,"“When I stepped inside the aircraft to welcome them, they mobbed me and started singing the Nigerian national anthem, there was nobody there singing about separation, they felt proud to be Nigerian, they rose in unison, that drew tears from me.”",1.18E+18,Twitter Web App,atiku,,Not Availabe,Not Availabe,Not Availabe,261,867,,
9/30/2019 7:51,"I would like to quote Mr. Onyeama. When the first plane of repatriated Nigerian citizens landed at Murtala Mohammed International Airport, Lagos, Mr. Onyeama said:",1.18E+18,Twitter Web App,atiku,,Not Availabe,Not Availabe,Not Availabe,191,596,,
9/30/2019 7:51,"By repatriating hundreds of Nigerians back home, at his cost, Mr. Onyeama and @flyairpeace, have revived hope in the Nigeria of our founding fathers' dream.",1.18E+18,Twitter Web App,atiku,,Not Availabe,Not Availabe,Not Availabe,226,731,,
9/30/2019 7:51,I also specifically want to cite the example of Chief Allen Onyeama and his public spiritedness which saw him offer relief to Nigerian citizens who were victims of the recent xenophobic attacks in South Africa.,1.18E+18,Twitter Web App,atiku,,Not Availabe,Not Availabe,Not Availabe,236,736,,
9/30/2019 7:51,My commendation goes to Governor @Bellomatawalle1 of Zamfara State for leading the way by massively investing in public education.,1.18E+18,Twitter Web App,atiku,,Not Availabe,Not Availabe,Not Availabe,256,878,,
9/30/2019 7:51,"It is an age-long truism that women are the teachers of a nation. I make bold to say that the greatness of our country, Nigeria has much to do with how well we educate how children, especially the girl-child.",1.18E+18,Twitter Web App,atiku,,Not Availabe,Not Availabe,Not Availabe,214,651,,
9/30/2019 7:51,"It is not all gloom and doom, however. There is still hope. Much hope. I took time to listen to a recent remark made by the Emir of Kano, HRM Muhammed Sanusi II about why we need to pay more attention to the issue of girl-child education.",1.18E+18,Twitter Web App,atiku,,Not Availabe,Not Availabe,Not Availabe,218,648,,
9/30/2019 7:51,"So, rather than just call for prayers today, I am calling on all Nigerians to believe in Nigeria’s betterment, to work for Nigeria’s betterment, and to insist that no one in Nigeria, no matter how highly placed, shall be bigger than the laws of our land.",1.18E+18,Twitter Web App,atiku,,Not Availabe,Not Availabe,Not Availabe,281,782,,
9/30/2019 7:51,"And certainly, all is not well when the media cannot freely express itself without the fear that those who wield the big stick would use it on them for saying things as they are.",1.18E+18,Twitter Web App,atiku,,Not Availabe,Not Availabe,Not Availabe,246,709,,
9/30/2019 7:51,"All is not well when Nigeria is now officially the world headquarters for extreme poverty and out of school children, yet the cost of maintaining those in government continues to grow, while the needs of the governed are not being met.",1.18E+18,Twitter Web App,atiku,,Not Availabe,Not Availabe,Not Availabe,306,839,,
9/30/2019 7:51,All is not well when judges are persecuted for enforcing the constitutionally guaranteed fundamental human rights of Nigerian citizens.,1.18E+18,Twitter Web App,atiku,,Not Availabe,Not Availabe,Not Availabe,283,780,,
9/30/2019 7:51,", by not just praying and showing understanding, but also to take democratic action to ensure that the ideals of our founding fathers - Unity and Faith, Peace and Progress - are not set aside on the altar of tyranny.",1.18E+18,Twitter Web App,atiku,,Not Availabe,Not Availabe,Not Availabe,243,729,,
9/30/2019 7:51,But I am mindful of the fact that the time for rhetoric has long since passed and now is the time for all lovers of Nigeria to take concrete steps to aid Nigeria’s progress,1.18E+18,Twitter Web App,atiku,,Not Availabe,Not Availabe,Not Availabe,239,740,,
9/30/2019 7:51,"I could call for prayers, as others would indeed call for today. I could also call on Nigerians to show more understanding, as indeed many have said in the past and will undoubtedly say again today.",1.18E+18,Twitter Web App,atiku,,Not Availabe,Not Availabe,Not Availabe,232,740,,
9/30/2019 7:51,"My dear citizens of Nigeria, I could go with the flow and the cliche and say all is well with Nigeria, but as the late Chinua Achebe once wrote, “when an adult is in the house, the she-goat is not left to suffer the pain of parturition on its tether”.",1.18E+18,Twitter Web App,atiku,,Not Availabe,Not Availabe,Not Availabe,302,905,,
9/30/2019 7:51,"Our judiciary is under attack, and our youths and activists, who should ordinarily be the future of Nigeria, would be facing the very real threat of arrest and intimidation should they speak out about the state of the nation.",1.18E+18,Twitter Web App,atiku,,Not Availabe,Not Availabe,Not Availabe,390,1015,,
9/30/2019 7:51,"On October 1, 1960, our nation’s founding fathers could never have fathomed that 59 years after birthing the largest black nation on earth, we would be facing a situation where we do not have a free press.",,Twitter Web App,,,Not Availabe,Not Availabe,Not Availabe,3342,11122,,
9/29/2019 10:13,"It is a cause for sobering emotions to read about the sudden demise of @MrStanleyNwabia. A patriotic Nigerian and forthright supporter of our great party. God Almighty console his family and may his soul Rest In Peace - AA.
https://t.co/Vfq4ilwDft",,Twitter for iPhone,,,Not Availabe,Not Availabe,Not Availabe,2127,5701,,
9/27/2019 8:26,Bishop David Oyedepo continues to contribute to deepening faith and upping moral values in Nigeria. His passion for and commitment to education is exemplary. I wish him a happy 65th birthday. -AA https://t.co/1znOmodBYQ,,Twitter for iPhone,,,Not Availabe,Not Availabe,Not Availabe,1667,11206,,
9/26/2019 21:43,"Chief Ufot Ekaette served Nigeria in diverse roles with dedication and integrity. His footprints shall remain indelible. On behalf of my family and associates, I condole with the Ekaette family &amp; Akwa Ibom State Govt on the loss of this patriot. May his soul rest in peace. -AA",,Twitter for iPhone,,,Not Availabe,Not Availabe,Not Availabe,487,3383,,
9/22/2019 16:43,"Mrs Toyin Ajinde's commitment to a better Nigeria was unparalleled. As a PDP woman leader in Ondo, she worked tirelessly to achieve this. I knew this because she was my longtime staunch supporter. I'm saddened by her loss. May her family be comforted &amp; her soul rest in peace. -AA",,Twitter for iPhone,,,Not Availabe,Not Availabe,Not Availabe,651,4927,,
9/20/2019 11:59,"Finally, I say to all concerned, that we will all die and give account of our lives to our Creator. 

Thank you and may God bless Nigeria.",1.18E+18,Twitter Web App,atiku,,Not Availabe,Not Availabe,Not Availabe,594,2957,,
9/20/2019 11:59,"I urge all Nigerians to continue their support for this recourse to constitutional order via the courts. Even if there is little or nothing you can do to ensure that justice is done in Nigeria, just believe that it will happen. Let us never underestimate the effect of our belief.",1.18E+18,Twitter Web App,atiku,,Not Availabe,Not Availabe,Not Availabe,415,2044,,
9/20/2019 11:59,"I also thank the governors elected on the platform of my party, the @OfficialPDPNig, as well as the National Executive Committee, for their unanimous and unambiguous support for the judicial phase of this struggle, especially after it was announced that we would go on to appeal.",1.18E+18,Twitter Web App,atiku,,Not Availabe,Not Availabe,Not Availabe,243,1021,,
9/20/2019 11:59,"I note the immense outpouring of goodwill from ordinary Nigerians in every nook and cranny of Nigeria and from all regions, religions and relationships. Once again I thank you all for your support.",1.18E+18,Twitter Web App,atiku,,Not Availabe,Not Availabe,Not Availabe,242,984,,
9/20/2019 11:59,"We must stand together to pursue this just cause all the way, so that our judiciary are not afraid to do their jobs and have to be wary of blackmail, intimidation, and victimisation.",1.18E+18,Twitter Web App,atiku,,Not Availabe,Not Availabe,Not Availabe,240,915,,
9/20/2019 11:59,"We must return to being Africa’s bastion of democracy, where the rights to Freedom of Speech and Freedom after the Speech, are guaranteed.",1.18E+18,Twitter Web App,atiku,,Not Availabe,Not Availabe,Not Availabe,269,998,,
9/20/2019 11:59,"Yes, those who do not want this as Nigeria’s reality, will use every trick in the book to undermine, discourage, misinform and mislead, but with God’s help and the support of Nigerians, we will ensure that Nigeria makes a course correction away from tyranny and towards democracy.",1.18E+18,Twitter Web App,atiku,,Not Availabe,Not Availabe,Not Availabe,248,944,,
9/20/2019 11:59,"It is for this, and other patriotic reasons, that I am pursuing this judicial route: To ensure that the votes of Nigerians count and are counted.",1.18E+18,Twitter Web App,atiku,,Not Availabe,Not Availabe,Not Availabe,254,962,,
9/20/2019 11:59,"And only by ensuring that democracy is not just done, but seen to be done, can Nigeria and Nigerians have a sense that this our dear land is indeed a land where Unity, Faith, Peace and Progress reside.",1.18E+18,Twitter Web App,atiku,,Not Availabe,Not Availabe,Not Availabe,231,918,,
