created_at,text,in_reply_to_status_id_str,source,in_reply_to_screen_name,contributors,quoted_status_id,quote_count,reply_count,retweet_count,favorite_count,retweeted,followers_count
6/1/2016 10:26,RT @thecableng: Restructuring for #Nigeria’s national unity https://t.co/HRu7JqA3HZ via @thecableng by @atiku,,Twitter for iPhone,,,Not Availabe,Not Availabe,Not Availabe,10,0,,
6/1/2016 10:26,"Dear @PremiumTimesng, this headline does not accurately represent my statement. Kindly correct. Thank you https://t.co/85BJn7hYx6",,Twitter for iPhone,,,7.37753E+17,Not Availabe,Not Availabe,543,94,,
5/31/2016 21:09,This is a record of my position on the 2014 confab online - do read please https://t.co/MilWrZmVKK https://t.co/CaR09aZ2EV,,Twitter for iPhone,,,7.37746E+17,Not Availabe,Not Availabe,47,39,,
5/31/2016 20:25,Nigeria's current structure and the practices it has encouraged have been a major impediment to our economic &amp; political development.,7.38E+17,Twitter for iPhone,atiku,,Not Availabe,Not Availabe,Not Availabe,146,52,,
5/31/2016 20:24,I have for a long time advocated the need to restructure our federation. The current structure doesn't work well. https://t.co/FIf9wMrWkE,7.38E+17,Twitter for iPhone,atiku,,Not Availabe,Not Availabe,Not Availabe,291,82,,
5/31/2016 20:11,"Honoured to have been invited to chair the presentation of this book ""We Are All Biafrans"". https://t.co/ZK3Ijc9wBv",,Twitter for iPhone,,,Not Availabe,Not Availabe,Not Availabe,300,173,,
5/31/2016 16:19,"My remarks at the Presentation of the book, “We Are All Biafrans” by Chido Onumah, at the Yar’Adua Centre Abuja https://t.co/GU1QoAX4Lp",,Twitter for iPhone,,,Not Availabe,Not Availabe,Not Availabe,90,58,,
5/30/2016 14:24,"RT @AtikuOrg: Sir, please be guided that the confirmed time for commencement of the book launch is 4pm. @atiku https://t.co/GK61eS4BXY",,Twitter for iPhone,,,7.3724E+17,Not Availabe,Not Availabe,28,0,,
5/30/2016 11:11,"I will be chairing the launch of the book ""We Are All Biafrans"" by Chido Onumah at the Yar'Adua Centre tomorrow at 7pm. Do come by.",,Twitter for iPhone,,,Not Availabe,Not Availabe,Not Availabe,263,119,,
5/29/2016 18:27,"As we celebrate #DemocracyDay, let us remember the sacrifices of everyone who paid the supreme price for opposing military rule.",,Twitter for iPhone,,,Not Availabe,Not Availabe,Not Availabe,160,128,,
5/29/2016 18:26,"RT @AtikuOrg: Let's keep hope alive, @Atiku urges Nigerians. #DemocracyDay https://t.co/933y8QRA3Z https://t.co/Jo4ZnxOdtO",,Twitter for iPhone,,,Not Availabe,Not Availabe,Not Availabe,40,0,,
5/28/2016 19:53,"RT @belloAUN: Our Experience is Global. Our Focus is Development. @AUNigeria, we are Proud of our students who live our Development Mission…",,Twitter for iPhone,,,Not Availabe,Not Availabe,Not Availabe,14,0,,
5/28/2016 19:53,RT @belloAUN: Students of @AUNigeria donate their work stipend to support a literacy and numeracy program for Almajiri boys - the 'Feed and…,,Twitter for iPhone,,,Not Availabe,Not Availabe,Not Availabe,19,0,,
5/28/2016 19:53,"RT @omonlakiki: H.E. @atiku, @AWTambuwal, Gov Abubakar Yari at the wedding fatiha of daughter of Alh Umaru Kobo in Sokoto, weekend https://…",,Twitter for iPhone,,,Not Availabe,Not Availabe,Not Availabe,25,0,,
5/27/2016 14:52,"Happy 90th birthday Oba Oladunni Oyewumi Ajagungbade III, the Soun of Ogbomoso. Olorun a je ki e pe fun wa o! https://t.co/JmDyoJ5i4r",,Twitter for iPhone,,,Not Availabe,Not Availabe,Not Availabe,153,195,,
5/27/2016 9:47,Let us help our kids grow right &amp; create a world where they can achieve their full potentials. Happy #ChildrensDay. https://t.co/t0sXJexxq7,,Twitter for iPhone,,,Not Availabe,Not Availabe,Not Availabe,363,345,,
5/25/2016 18:00,"I received the Greater Gbagyi Development Initiative, led by the Etsu Kwali, Alhaji (Dr) Shaban Nizuzzo
Audu today. https://t.co/mg9CMin8la",,Twitter for iPhone,,,Not Availabe,Not Availabe,Not Availabe,93,135,,
5/24/2016 18:49,"Was honoured to receive the Ooni of Ife, Oba Adeyeye Enitan Ogunwusi today at my home. https://t.co/xf7mgyDxQJ",,Twitter for iPhone,,,Not Availabe,Not Availabe,Not Availabe,144,213,,
5/24/2016 16:55,"I also sympathise with the family of Senator @shehusani over the death of his dear mother, Amina Abdullahi Shehu. May you be comforted.",,Twitter for iPhone,,,Not Availabe,Not Availabe,Not Availabe,51,48,,
5/24/2016 16:49,Senator Nwali was the first black man to obtain a PhD in Computer and Analytical studies from Harvard University. A great son of Nigeria.,7.35E+17,Twitter for iPhone,atiku,,Not Availabe,Not Availabe,Not Availabe,79,31,,
5/24/2016 16:48,"My sympathies go to the Nwali family on the passing of Senator Offia Nwali, who in 1979, pioneered the process for creation of Ebonyi State.",,Twitter for iPhone,,,Not Availabe,Not Availabe,Not Availabe,75,58,,
5/23/2016 11:15,Thank you! #InvestInNigeria  https://t.co/bTzv1EZKBM,,Twitter for iPhone,,,Not Availabe,Not Availabe,Not Availabe,17,31,,
5/21/2016 19:06,RT @SpeakerDogara: With Alhaji @atiku Abubakar and Chief Audu Ogbeh at the Rico Gado groundbreaking ceremony in Abuja earlier today. https:…,,Twitter for iPhone,,,Not Availabe,Not Availabe,Not Availabe,121,0,,
5/21/2016 17:29,"Very proud how far we've come, with the groundbreaking of our new Abuja factory. #InvestInNigeria https://t.co/LYt4R2vCCf",,Twitter for iPhone,,,Not Availabe,Not Availabe,Not Availabe,236,261,,
5/21/2016 12:26,"RT @AtikuOrg: Despite the doubts about our economy because of current challenges, we are confident about Nigeria's future and about our fut…",,Twitter for iPhone,,,Not Availabe,Not Availabe,Not Availabe,70,0,,
5/21/2016 12:26,"RT @AtikuOrg: This plant, on a 5 hectare land in Idu Industrial Layout, is expected to be completed in 32 weeks, with capacity of 50 tonnes…",,Twitter for iPhone,,,Not Availabe,Not Availabe,Not Availabe,50,0,,
5/21/2016 12:26,"RT @AtikuOrg: Today, we are here in Abuja to break ground for our second, even bigger plant, which will create an even longer value chain.…",,Twitter for iPhone,,,Not Availabe,Not Availabe,Not Availabe,40,0,,
5/21/2016 12:26,"RT @AtikuOrg: It's early days, but I think we’re on the right track. I'm very proud of Rico Gado Nutrition Nigeria's first plant &amp; agric cl…",,Twitter for iPhone,,,Not Availabe,Not Availabe,Not Availabe,36,0,,
5/21/2016 12:26,RT @AtikuOrg: We wanted to ensure that the bulk of the value added stayed with the farmers who do the hard work of growing grains and seeds…,,Twitter for iPhone,,,Not Availabe,Not Availabe,Not Availabe,35,0,,
5/21/2016 12:25,RT @AtikuOrg: We went against the norm of doing business in Nigeria. We didn't just want to build a factory; we wanted to build a value cha…,,Twitter for iPhone,,,Not Availabe,Not Availabe,Not Availabe,36,0,,
5/21/2016 12:25,"RT @AtikuOrg: We are contributing to job creation, technology transfer and progressive change in farming culture. There is a future in farm…",,Twitter for iPhone,,,Not Availabe,Not Availabe,Not Availabe,39,0,,
5/21/2016 12:25,RT @AtikuOrg: More strategic agriculture investments will help us get over our dangerous addiction to oil revenues. - @atiku,,Twitter for iPhone,,,Not Availabe,Not Availabe,Not Availabe,36,0,,
5/21/2016 12:25,RT @AtikuOrg: Let me be clear: A profitable feedstock mill is no magic fix that solves all of our problems. It is a small piece in a big pu…,,Twitter for iPhone,,,Not Availabe,Not Availabe,Not Availabe,37,0,,
5/21/2016 12:25,"RT @AtikuOrg: Our feed is reducing the land required to feed cattle. We hope that in the future, it will help defuse the herder/farmer conf…",,Twitter for iPhone,,,Not Availabe,Not Availabe,Not Availabe,35,0,,
5/21/2016 12:25,RT @AtikuOrg: The mill produces 20 tonnes per hour of carefully balanced and locally sourced quality fodder for a wide range of livestock -…,,Twitter for iPhone,,,Not Availabe,Not Availabe,Not Availabe,32,0,,
5/21/2016 12:25,"RT @AtikuOrg: Today, the Yola feed mill is exactly what we had hoped for - an economically viable enterprise, and a catalyst for change. -…",,Twitter for iPhone,,,Not Availabe,Not Availabe,Not Availabe,28,0,,
5/21/2016 12:25,"RT @AtikuOrg: We went ahead because we had faith in our venture, and knew that we had an opportunity to change how our agricultural sector…",,Twitter for iPhone,,,Not Availabe,Not Availabe,Not Availabe,26,0,,
5/21/2016 12:25,RT @AtikuOrg: Investing in Adamawa did not seem wise. Similar questions were asked when I founded @AUNigeria in Yola rather than Lagos or A…,,Twitter for iPhone,,,Not Availabe,Not Availabe,Not Availabe,29,0,,
5/21/2016 12:25,"RT @AtikuOrg: At the time of the ground-breaking, there was insecurity in the North East, which was affecting Yola and Adamawa - @atiku",,Twitter for iPhone,,,Not Availabe,Not Availabe,Not Availabe,24,0,,
5/21/2016 12:25,"RT @AtikuOrg: My friend had a point: many agro-allied businesses in Nigeria had failed, including my own earlier attempt many years ago. -…",,Twitter for iPhone,,,Not Availabe,Not Availabe,Not Availabe,28,0,,
5/21/2016 12:25,"RT @AtikuOrg: When we broke ground for our Yola factory, a good friend asked if this is the best time or place to invest in agribusiness? -…",,Twitter for iPhone,,,Not Availabe,Not Availabe,Not Availabe,28,0,,
5/21/2016 12:25,"RT @AtikuOrg: H.E. @atiku's speech at the Ground-breaking ceremony of Rico Gado Nutrition Nigeria's Factory, Abuja  coming up #InvestInNige…",,Twitter for iPhone,,,Not Availabe,Not Availabe,Not Availabe,31,0,,
5/20/2016 18:46,Because education always makes a difference #EducationSolutions  https://t.co/B67rTubgov,,Twitter for iPhone,,,Not Availabe,Not Availabe,Not Availabe,87,37,,
5/20/2016 16:02,"But beyond feeding &amp; educating, personally meeting IDPs gives hope, which has much greater value @RotimiLawale @TunjiMoronfoye @AtikuOrg",7.34E+17,Twitter for iPhone,atiku,,Not Availabe,Not Availabe,Not Availabe,29,19,,
5/20/2016 16:01,"For example, @AUNigeria had been feeding IDPs long before the FG then. Also taught IDP kids to read @RotimiLawale @TunjiMoronfoye @AtikuOrg",7.34E+17,Twitter for iPhone,atiku,,Not Availabe,Not Availabe,Not Availabe,29,15,,
5/20/2016 15:59,"Dear Rotimi, a few weeks ago, at #LSEAfrica, I talked about how we are helping IDPs, especially in Yola.  https://t.co/yRiKGxktTu",,Twitter for iPhone,,,7.33667E+17,Not Availabe,Not Availabe,33,25,,
5/20/2016 14:48,Happy to announce we will be breaking ground for our new feed factory tomorrow in Abuja. #InvestInNigeria #Jobs,,Twitter for iPhone,,,Not Availabe,Not Availabe,Not Availabe,146,116,,
5/19/2016 12:25,RT @AtikuOrg: Herdsmen-Farmers conflicts: Atiku Abubakar building factory to produce cattle feed. Read https://t.co/hZ4Pnyk3OT… https://t.c…,,Twitter for iPhone,,,Not Availabe,Not Availabe,Not Availabe,83,0,,
5/18/2016 17:33,The best news I've heard in months! I still believe the #ChibokGirls will return https://t.co/gkuSHrZq24,,Twitter for iPhone,,,7.32985E+17,Not Availabe,Not Availabe,112,61,,
5/15/2016 16:01,Emphatic win from the @Arsenal. Extra bonus of finishing above our rivals Tottenham. #smile,,Twitter for iPhone,,,Not Availabe,Not Availabe,Not Availabe,297,127,,
5/15/2016 11:36,"Another generation of leaders graduated yesterday. Can't wait to see great things from you, @AUNigeria Class of 2016 https://t.co/JyaNGfNlPs",,Twitter for iPhone,,,Not Availabe,Not Availabe,Not Availabe,242,289,,
5/15/2016 8:42,"RT @AtikuOrg: Yesterday, the 8th graduation ceremony of @AUNigeria held in Yola, Adamawa State. See photos https://t.co/TDA6vFCvv6 https://…",,Twitter for iPhone,,,Not Availabe,Not Availabe,Not Availabe,33,0,,
5/14/2016 10:03,"RT @AtikuOrg: Photos from @AUNigeria's Graduation award ceremony, May 13, 2016. See more - https://t.co/veI8fw0y5p https://t.co/LuCFJ0mMln",,Twitter for iPhone,,,Not Availabe,Not Availabe,Not Availabe,32,0,,
5/12/2016 17:42,RT @AtikuOrg: Gov Bindow receiving @atiku when he arrived Yola for the 8th Graduation ceremony of the AUN https://t.co/XguOP37R0b https://t…,,Twitter for iPhone,,,Not Availabe,Not Availabe,Not Availabe,41,0,,
5/7/2016 18:32,"As an Arsenal fan, I'm much happier Leicester City won, rather than Tottenham, our rivals.",,Twitter for iPhone,,,Not Availabe,Not Availabe,Not Availabe,467,234,,
5/5/2016 14:52,Prince Adeniji Adele would always be remembered for his gallant role to free Nigeria from repressive military rule. May he rest in peace.,,Twitter for iPhone,,,Not Availabe,Not Availabe,Not Availabe,123,125,,
5/5/2016 14:52,"RT @AtikuOrg: ""Prince Adeniji Adele was a formidable pro-democracy fighter."" - @atiku. https://t.co/nJbYH3Q1oc",,Twitter for iPhone,,,Not Availabe,Not Availabe,Not Availabe,11,0,,
5/5/2016 8:15,Well done.  https://t.co/2PKBiTyRRL,,Twitter for iPhone,,,7.26335E+17,Not Availabe,Not Availabe,13,20,,
5/3/2016 11:58,"Journalists &amp; media houses in turn must endeavor to use their platforms to promote peace, harmony and good governance. #WorldPressFreedomDay",7.27E+17,Twitter for iPhone,atiku,,Not Availabe,Not Availabe,Not Availabe,58,40,,
5/3/2016 11:57,"As we celebrate #WorldPressFreedomDay, we must ensure that the right of Nigerian journalists to operate without hindrance is respected.",,Twitter for iPhone,,,Not Availabe,Not Availabe,Not Availabe,74,115,,
5/1/2016 19:43,Heartfelt condolences to the family of Amb. Hamzat Ahmad and the people of Sokoto. He was a diplomat par excellence. May he rest in peace.,,Twitter for iPhone,,,Not Availabe,Not Availabe,Not Availabe,112,135,,
5/1/2016 19:08,"RT @AtikuOrg: May Day: Keep the faith, @Atiku urges Nigerian workers https://t.co/3eP3jT0UDO https://t.co/9rkOa7XK4E",,Twitter for iPhone,,,Not Availabe,Not Availabe,Not Availabe,33,0,,
4/30/2016 7:35,"RT @AtikuOrg: Atiku mourns Omo n’Oba n’Edo Uku Akpolokpolo, Oba Erediauwa of Benin - 
https://t.co/38ehs8oGMu https://t.co/WAHUDzgEhZ",,Twitter for iPhone,,,Not Availabe,Not Availabe,Not Availabe,26,0,,
4/28/2016 8:06,Societies with better access to education have better overall indicators #LSEAfricaSummit https://t.co/VScBpMt7kw https://t.co/KpEwBJkwWj,7.26E+17,Twitter for iPhone,atiku,,Not Availabe,Not Availabe,Not Availabe,74,58,,
4/28/2016 7:54,"""Unless we develop new solutions for education, by 2050...we'll be a country full of uneducated and hopeless people"" https://t.co/TEeteilS8U",,Twitter for iPhone,,,Not Availabe,Not Availabe,Not Availabe,419,252,,
4/27/2016 18:03,"""By 2050, Nigeria will Be a Nation of Hopeless Young People If…"" https://t.co/TClPJuzGQS https://t.co/RPx0Z0Wn7c",,Twitter for iPhone,,,Not Availabe,Not Availabe,Not Availabe,63,38,,
4/26/2016 11:15,The British sent my father to jail so I can go to school. But I am thankful I was forced to school. https://t.co/xdxgMq2hTF,,Twitter for iPhone,,,Not Availabe,Not Availabe,Not Availabe,325,231,,
4/25/2016 8:15,Full text of my #LSEAfricaSummit speech: Philanthropy &amp; Human Capital Development in Africa https://t.co/8n6BReDftq https://t.co/SiqWbJDpTm,,Twitter for iPhone,,,Not Availabe,Not Availabe,Not Availabe,90,107,,
4/23/2016 17:27,"RT @AtikuOrg: ""I setup a micro-finance bank to give loans in the North East to entrepreneurs. Women repaid 98% of the time, men, less than…",,Twitter for iPhone,,,Not Availabe,Not Availabe,Not Availabe,206,0,,
4/23/2016 17:27,"RT @AtikuOrg: ""If you empower women entrepreneurs, you empower a whole family"" - @atiku",,Twitter for iPhone,,,Not Availabe,Not Availabe,Not Availabe,171,0,,
4/23/2016 17:27,"RT @AtikuOrg: ""Private efforts, including philanthropy, are not a substitute for targeted &amp; efficiently managed public investments"" - @atiku",,Twitter for iPhone,,,Not Availabe,Not Availabe,Not Availabe,33,0,,
4/23/2016 17:27,"RT @AtikuOrg: ""African states have the primary responsibility for security, education, healthcare and the provision of good governance."" -…",,Twitter for iPhone,,,Not Availabe,Not Availabe,Not Availabe,39,0,,
4/23/2016 17:27,"RT @AtikuOrg: ""@AUNigeria has had great impact in the Yola community, and given it hope. That is why I founded this University."" - @atiku",,Twitter for iPhone,,,Not Availabe,Not Availabe,Not Availabe,31,0,,
4/23/2016 17:27,"RT @AtikuOrg: ""Quoting one of the Chibok girls: 
Education gives me the wings to fly, the power to fight, and the voice to speak."" - @atiku",,Twitter for iPhone,,,Not Availabe,Not Availabe,Not Availabe,44,0,,
4/23/2016 17:27,"RT @AtikuOrg: ""@AUNigeria is now educating 27 of the brave and resilient young women from Chibok who escaped Boko Haram, on full scholarshi…",,Twitter for iPhone,,,Not Availabe,Not Availabe,Not Availabe,47,0,,
4/23/2016 17:26,"RT @AtikuOrg: ""@AUNigeria has created 53 libraries in our poor region of Northeastern Nigeria - from primary schools to universities"" -  @a…",,Twitter for iPhone,,,Not Availabe,Not Availabe,Not Availabe,23,0,,
4/23/2016 17:26,"RT @AtikuOrg: ""@AUNigeria established the Adamawa Peacemakers initiative, with support from Christian and Muslim leaders, driven by student…",,Twitter for iPhone,,,Not Availabe,Not Availabe,Not Availabe,26,0,,
4/23/2016 17:26,"RT @AtikuOrg: ""Tech is essential for mass education. @AUNigeria, as a development university, is pioneering a new way to educate in Nigeria…",,Twitter for iPhone,,,Not Availabe,Not Availabe,Not Availabe,26,0,,
4/23/2016 17:26,"RT @AtikuOrg: ""@AUNigeria students design the TRLA programmes, content, strategy etc, not faculty"" - @atiku",,Twitter for iPhone,,,Not Availabe,Not Availabe,Not Availabe,23,0,,
4/23/2016 17:26,"RT @AtikuOrg: ""2000 children are being taught using tablet computers with applications written in Hausa and Fulfulde, by @AUNigeria student…",,Twitter for iPhone,,,Not Availabe,Not Availabe,Not Availabe,39,0,,
4/23/2016 17:26,"RT @AtikuOrg: ""@AUNigeria is, I believe, one of the first universities in the world whose stated mission is to be a ""development university…",,Twitter for iPhone,,,Not Availabe,Not Availabe,Not Availabe,30,0,,
4/23/2016 17:26,"RT @AtikuOrg: ""Societies with widespread access to higher education have better life, health and economic indicators, as well as stability""…",,Twitter for iPhone,,,Not Availabe,Not Availabe,Not Availabe,29,0,,
4/23/2016 17:26,"RT @AtikuOrg: ""Higher education not only boosts individual incomes of its graduates, but also the overall GDP of African nations."" - @atiku",,Twitter for iPhone,,,Not Availabe,Not Availabe,Not Availabe,31,0,,
4/23/2016 17:26,"RT @AtikuOrg: ""We choose to site @AUNigeria because in Yola because this is where I met the Peace Corps, who educated me"" - @atiku",,Twitter for iPhone,,,Not Availabe,Not Availabe,Not Availabe,27,0,,
4/23/2016 17:26,"RT @AtikuOrg: ""Some of this (philanthropy) has taken the form of providing university scholarships for promising young people"" - @atiku",,Twitter for iPhone,,,Not Availabe,Not Availabe,Not Availabe,26,0,,
4/23/2016 17:26,"RT @AtikuOrg: ""The bulk of my efforts have gone toward fostering formal education in my home country, Nigeria."" - @atiku",,Twitter for iPhone,,,Not Availabe,Not Availabe,Not Availabe,27,0,,
4/23/2016 16:34,"RT @Movemeback: ""Why should we export our best and brightest? We need them in Africa. 

We need YOU in Africa.""
@atiku @LSEAfricaSummit #LS…",,Twitter for iPhone,,,Not Availabe,Not Availabe,Not Availabe,23,0,,
4/23/2016 15:45,"RT @LSEAfricaSummit: ""Philanthropy and entrepreneurship has led to the building of places like schools and churches in various areas."" - @a…",,Twitter for iPhone,,,Not Availabe,Not Availabe,Not Availabe,27,0,,
4/23/2016 15:45,RT @LSEAfricaSummit: His Excellency @atiku will be giving the Keynote Address for the Philanthropy Panel. #LSEAfricaSummit,,Twitter for iPhone,,,Not Availabe,Not Availabe,Not Availabe,16,0,,
4/23/2016 15:45,"RT @AtikuOrg: ""As Africa struggles to live up to the expectation, it is appropriate to focus on Africa’s human resources"" - @atiku",,Twitter for iPhone,,,Not Availabe,Not Availabe,Not Availabe,37,0,,
4/23/2016 15:38,About to begin my session. #LSEAfricaSummit https://t.co/4PghVm15b0,,Twitter for iPhone,,,Not Availabe,Not Availabe,Not Availabe,55,54,,
4/23/2016 8:12,It was good to meet you and all the organizers. Very proud of what you have done.  https://t.co/bGNJWsQHVH,,Twitter for iPhone,,,7.23654E+17,Not Availabe,Not Availabe,34,38,,
4/22/2016 17:12,It's now more important than ever to use our resources in a sustainable and non-injurious manner for the good of our planet #EarthDay2016,7.24E+17,Twitter for iPhone,atiku,,Not Availabe,Not Availabe,Not Availabe,102,62,,
4/22/2016 17:12,"This year, Nigeria experienced very high temperatures. The heat in March was the highest we've ever recorded.",,Twitter for iPhone,,,Not Availabe,Not Availabe,Not Availabe,299,80,,
4/21/2016 8:04,"RT @AtikuOrg: H.E. @Atiku in a chat with Governor Bindow of Adamawa, before departure for #LSEAfricaSummit https://t.co/KLFz8i7qd0",,Twitter for iPhone,,,Not Availabe,Not Availabe,Not Availabe,57,0,,
4/21/2016 8:01,I'll be speaking on philanthropy &amp; capacity building at #LSEAfricaSummit. Please send me any questions you may have. https://t.co/GTDQGIcHOL,,Twitter for iPhone,,,Not Availabe,Not Availabe,Not Availabe,267,362,,
4/19/2016 19:30,RT @AUNigeria: AUN's Founder @atiku is also one of the keynote speakers on the Philanthropy Panel at the @LSEAfricaSummit this week.,,Twitter for iPhone,,,Not Availabe,Not Availabe,Not Availabe,25,0,,
4/18/2016 20:20,"My special thanks to HRM Otumfuo Osei Tutu II, for his hospitality at the  wedding of our children, Nana and Aminu https://t.co/IFS612b1QO",,Twitter for iPhone,,,Not Availabe,Not Availabe,Not Availabe,180,258,,
4/18/2016 20:07,#smile  https://t.co/42hwKbelf8,,Twitter for iPhone,,,Not Availabe,Not Availabe,Not Availabe,144,54,,
4/18/2016 17:25,RT @AtikuOrg: Tears pour as @AUNigeria holds symbolic walk for missing Chibok girls https://t.co/1jYaSpn5Uc https://t.co/MOh9iv0L85,,Twitter for iPhone,,,Not Availabe,Not Availabe,Not Availabe,23,0,,
4/17/2016 11:21,Haha! I'm still in Ghana.  https://t.co/x27xSlqPn4,,Twitter for iPhone,,,7.21647E+17,Not Availabe,Not Availabe,115,34,,
4/16/2016 20:04,I'm now an in-law in Ghana! My son Aminu just completed his marriage rites. https://t.co/dJFQVBfvRl,,Twitter for iPhone,,,Not Availabe,Not Availabe,Not Availabe,641,490,,
4/14/2016 17:12,RT @BBCAfrica: Meet one of the Chibok girls who's now studying computer science 📻 https://t.co/d5V7gYtKD7 https://t.co/mh9oEPzljd,,Twitter for iPhone,,,Not Availabe,Not Availabe,Not Availabe,87,0,,
4/14/2016 17:11,"This is a very touching recording of one of the #ChibokGirls, now studying Computer Science at @AUNigeria https://t.co/zHPql9yxZD",,Twitter for iPhone,,,Not Availabe,Not Availabe,Not Availabe,68,37,,
4/14/2016 13:12,"I am confident that this administration is committed to bringing the Chibok girls home, to ensure the closure of this sad chapter.",7.21E+17,Twitter for iPhone,atiku,,Not Availabe,Not Availabe,Not Availabe,116,37,,
4/14/2016 13:11,I have young daughters &amp; I can only imagine the pain of forcibly separating them from me. I can only imagine the pains of the Chibok parents,7.21E+17,Twitter for iPhone,atiku,,Not Availabe,Not Availabe,Not Availabe,116,42,,
4/14/2016 13:08,"Earlier today, my daughter asked me if the Chibok girls will be brought back home. I told her I am positive they would, and I meant it.",,Twitter for iPhone,,,Not Availabe,Not Availabe,Not Availabe,257,169,,
4/12/2016 18:09,"RT @LSEAfricaSummit: Meet the Speakers on our Philanthropy panel, including H.E. @atiku Abubakar &amp; @parmindervir (OBE): https://t.co/1Mj0Jt…",,Twitter for iPhone,,,Not Availabe,Not Availabe,Not Availabe,24,0,,
4/9/2016 20:22,"This is incorrect. I said I see myself as a businessman first, then politician. Your headline is misleading. https://t.co/VfpbcqAnV9",,Twitter for iPhone,,,7.18875E+17,Not Availabe,Not Availabe,390,92,,
4/9/2016 16:55,RT @adebayo_bsegun: @atiku my mum was part of your team; she still speaks well you and her nickname then,,Twitter for iPhone,,,Not Availabe,Not Availabe,Not Availabe,8,0,,
4/9/2016 16:47,RT @Samuel_NET: I owe you a drink for this truth @atiku.I realised this while producing garri.There's an entire chain for most items https:…,,Twitter for iPhone,,,7.18841E+17,Not Availabe,Not Availabe,11,0,,
4/9/2016 16:42,"Yes! For example, that's where I learned that exporting agric products is more about supply chain than just farming https://t.co/Vpqw9ufC7p",,Twitter for iPhone,,,Not Availabe,Not Availabe,Not Availabe,31,29,,
4/9/2016 16:36,The Story of My Life is available online free https://t.co/ER1Xw8dyCx https://t.co/IyYUnPaEKO,,Twitter for iPhone,,,7.18839E+17,Not Availabe,Not Availabe,44,35,,
4/9/2016 16:34,"My advice to any young person joining the Customs, don't be a hindrance to trade. Instead, by friendly with businessmen. They know so much!",7.19E+17,Twitter for iPhone,atiku,,Not Availabe,Not Availabe,Not Availabe,94,34,,
4/9/2016 16:28,One of the best opportunities I had while in Customs was working with the USDEA. It taught me organization. https://t.co/PYDPRBlp4F,7.19E+17,Twitter for iPhone,atiku,,Not Availabe,Not Availabe,Not Availabe,55,46,,
4/9/2016 16:18,"As a Customs officer, I met so many businessman, doing major international business. I always took time to ask: how do you do business?",7.19E+17,Twitter for iPhone,atiku,,Not Availabe,Not Availabe,Not Availabe,55,32,,
4/9/2016 16:12,Working in the Customs &amp; Excise Department put us in contact with businesses from all over the world. It's like an intense MBA @laruchi007,7.19E+17,Twitter for iPhone,atiku,,Not Availabe,Not Availabe,Not Availabe,35,17,,
4/9/2016 16:09,I was indeed well treated by the service. It gave me a very high level understanding of international business.  https://t.co/NYD2wRP265,,Twitter for iPhone,,,7.18832E+17,Not Availabe,Not Availabe,47,29,,
