created_at,text,in_reply_to_status_id_str,source,in_reply_to_screen_name,contributors,quoted_status_id,quote_count,reply_count,retweet_count,favorite_count,retweeted,followers_count
11/25/2018 15:55,"I'm also grateful to my former boss, President Olusegun Obasanjo, who not only came but made a very moving speech to honour me. https://t.co/oKlIqPGBC1",1.07E+18,Twitter for iPhone,atiku,,Not Availabe,Not Availabe,Not Availabe,1252,4944,,
11/25/2018 15:55,Today is one I will never forget in a hurry; my official turbaning as the 7th Waziri of the Adamawa Emirate Council &amp; my birthday all rolled into one. I'm humbled by the support from far and near. May Allah bless you all for making it a truly special day for me and my family. -AA https://t.co/hrlmvCXAjf,,Twitter for iPhone,,,Not Availabe,Not Availabe,Not Availabe,2548,9809,,
11/25/2018 10:28,RT @omonlakiki: How fitting it is that HE @atiku is officially turbaned as Waziri Adamawa on his 72nd birthday. #TheWaziriTurbaning #Atikus…,,Twitter for iPhone,,,Not Availabe,Not Availabe,Not Availabe,227,0,,
11/24/2018 18:11,"At the Founder’s Day of @AUNigeria, recent events in Metele which resulted in loss of many of our gallant soldiers weighed heavily on my heart. Therefore, it was important to request a minute’s silence in their memory and those of all fallen soldiers at the front lines. -AA https://t.co/ExoObFX6hJ",,Twitter for iPhone,,,Not Availabe,Not Availabe,Not Availabe,1312,4119,,
11/24/2018 13:52,".@AUNigeria’s impact in the community shows that if we work together, we can make a difference. https://t.co/pdydC7cN3X",,Twitter for iPhone,,,1.0659E+18,Not Availabe,Not Availabe,1054,2651,,
11/23/2018 15:45,RT @atiku: May God bless the Nigerian military. May God bless the Nigerian Army. May God bless Nigeria.,,Twitter for iPhone,,,Not Availabe,Not Availabe,Not Availabe,735,0,,
11/23/2018 15:45,RT @atiku: I’m deeply saddened by the loss of our soldiers in these attacks and ask for the support and prayers of all Nigerians for our mi…,,Twitter for iPhone,,,Not Availabe,Not Availabe,Not Availabe,3005,0,,
11/23/2018 7:02,I’m deeply saddened by the loss of our soldiers in these attacks and ask for the support and prayers of all Nigerians for our military in this war against ISWAP &amp; Boko Haram. https://t.co/0euJ9A3Ti3,,Twitter for iPhone,,,Not Availabe,Not Availabe,Not Availabe,3005,7574,,
11/22/2018 9:41,May God bless the Nigerian military. May God bless the Nigerian Army. May God bless Nigeria.,1.07E+18,Twitter for iPhone,atiku,,Not Availabe,Not Availabe,Not Availabe,735,2282,,
11/22/2018 9:41,"Finally, I call on the FG to think about setting up a benevolent fund for the support of widows and children of our fallen military heroes, run by an independent body, to which the public and corporate bodies can pay in funds. This is the least that we owe these gallant heroes.",1.07E+18,Twitter for iPhone,atiku,,Not Availabe,Not Availabe,Not Availabe,802,2240,,
11/22/2018 9:41,"I also call on all Nigerians, rich or poor to do what they can for the families of our fallen heroes. They gave us all. We owe it to them to show love and support to the families they left behind.",1.07E+18,Twitter for iPhone,atiku,,Not Availabe,Not Availabe,Not Availabe,393,945,,
11/22/2018 9:41,"I further call on those who desire to celebrate my birthday, that instead of sending me gifts, they should donate their gifts and money to the widows and orphans of our fallen military heroes.",1.07E+18,Twitter for iPhone,atiku,,Not Availabe,Not Availabe,Not Availabe,606,1551,,
11/22/2018 9:41,"As such, I hereby declare an endowment to provide full financial scholarships to five children of our fallen heroes from the 157 Task Force Battalion in Metele up to whatever level they are able and willing to reach at the American University of Nigeria, Yola.",1.07E+18,Twitter for iPhone,atiku,,Not Availabe,Not Availabe,Not Availabe,684,1487,,
11/22/2018 9:41,"These men and women gave their best and we must reciprocate their sacrificial giving. Therefore, instead of celebrating my birthday this year, which is coming up in a few days, I choose to rather celebrate our fallen heroes.",1.07E+18,Twitter for iPhone,atiku,,Not Availabe,Not Availabe,Not Availabe,313,703,,
11/22/2018 9:41,I feel immense sadness when I think of the families they leave behind and pray for Almighty God to grant their surviving family members fortitude to bear up in a time like this.,1.07E+18,Twitter for iPhone,atiku,,Not Availabe,Not Availabe,Not Availabe,300,689,,
11/22/2018 9:41,"The gallant men and women of our security services are our first and last line of defence against enemies of our nation and deserve the support and confidence of all Nigerians. We sleep well at night in our beds, because they stay awake uncomfortably in the fields.",1.07E+18,Twitter for iPhone,atiku,,Not Availabe,Not Availabe,Not Availabe,339,737,,
11/22/2018 9:41,These deaths are very painful and the loss of even one member of our armed forces pierces my heart because these heroes did not have to die. They volunteered to do a job that keeps this nation safe.,1.07E+18,Twitter for iPhone,atiku,,Not Availabe,Not Availabe,Not Availabe,376,881,,
11/22/2018 9:41,"My condolences to the Nigerian Army over the recent attack that led to loss of lives of officers and men of the 157 Task Force Battalion in Metele, Borno State.",,Twitter for iPhone,,,Not Availabe,Not Availabe,Not Availabe,2284,5979,,
11/21/2018 15:25,I am 100% for 100% of Nigerians 100% of the time. Nigerians should never be divided by ethnic or religious lines. We must be united. We are ONE Nigeria. https://t.co/ih7J0wwAQZ,,Twitter for iPhone,,,Not Availabe,Not Availabe,Not Availabe,3577,9795,,
11/20/2018 8:49,"Happy 61st birthday Dr. Goodluck Jonathan (@GEJonathan), our former president and ever distinctive face of democracy in Africa. I also, heartily congratulate you on the launch of #MyTransitionHours today.

Wishing you continued good health, long life and many happy returns.-AA https://t.co/zS2oiCc1x1",,Twitter for iPhone,,,Not Availabe,Not Availabe,Not Availabe,3404,11750,,
11/20/2018 7:00,The celebration of the Maulud today is a reminder to us to seek peace and establish understanding with other people. I implore the Muslim Ummah to celebrate the birth of the Holy Prophet SAW by following his traditions as I wish us Happy Maulud.,,Twitter for iPhone,,,Not Availabe,Not Availabe,Not Availabe,1541,6038,,
11/19/2018 11:24,Thank you for watching and listening. May God bless you and may God bless the Federal Republic of Nigeria. #TheAtikuPlan,1.06E+18,Twitter for iPhone,atiku,,Not Availabe,Not Availabe,Not Availabe,1014,2948,,
11/19/2018 11:23,It is time to Get Nigeria Working Again. I appeal to you to join me on this journey towards a better life for all Nigerians. #TheAtikuPlan,1.06E+18,Twitter for iPhone,atiku,,Not Availabe,Not Availabe,Not Availabe,1031,2459,,
11/19/2018 11:22,"I started out as an orphan selling firewood on the streets of Jada in Adamawa, but God, through the Nigerian state, invested in me and here I am today. If Nigeria worked for me, I owe it as my duty to make sure that Nigeria also works for you. #TheAtikuPlan",1.06E+18,Twitter for iPhone,atiku,,Not Availabe,Not Availabe,Not Availabe,1428,2697,,
11/19/2018 11:21,"And I am not just presenting these policies to you, I want you to own them. Take a look at them. You can view them at https://t.co/ge4jFismXf and on the pamphlets that we are making available to the public, you will have an opportunity to provide your feedback. #TheAtikuPlan",1.06E+18,Twitter for iPhone,atiku,,Not Availabe,Not Availabe,Not Availabe,966,1425,,
11/19/2018 11:20,Let me be clear no state will receive less funding than they get today – in fact all will receive more and the harder a state works the more they will get. #TheAtikuPlan,1.06E+18,Twitter for iPhone,atiku,,Not Availabe,Not Availabe,Not Availabe,790,1352,,
11/19/2018 11:19,My plan to restructure Nigeria will lead to a vast increase in the Internally Generated Revenue both for the Federal Government and the states via the matching grants that we will provide to state governments that increase their own revenue. #TheAtikuPlan,1.06E+18,Twitter for iPhone,atiku,,Not Availabe,Not Availabe,Not Availabe,771,1201,,
11/19/2018 11:18,Our National Innovation Fund and SME Venture Capital Fund initiatives will provide stable and sustainable long-term support to aspiring entrepreneurs. #TheAtikuPlan,1.06E+18,Twitter for iPhone,atiku,,Not Availabe,Not Availabe,Not Availabe,680,1038,,
11/19/2018 11:17,"My team and I will also help create jobs by innovating flagship programmes such as the National Open Apprenticeship Programme through which we shall enhance the capacity of Master-Craftsmen and women to train 1,000,000 new apprentices every year. #TheAtikuPlan",1.06E+18,Twitter for iPhone,atiku,,Not Availabe,Not Availabe,Not Availabe,805,1296,,
11/19/2018 11:17,These investments will create a minimum of 2.5 million jobs annually and lift at least 50 million people from poverty in the first 2 years. #TheAtikuPlan,1.06E+18,Twitter for iPhone,atiku,,Not Availabe,Not Availabe,Not Availabe,789,1246,,
11/19/2018 11:17,"If elected President, I will be pro-active in attracting investments and supporting the 50 million small and medium scale enterprises across Nigeria for the purpose of doubling the size of our Gross Domestic Product to US$900 billion by 2025. #TheAtikuPlan",1.06E+18,Twitter for iPhone,atiku,,Not Availabe,Not Availabe,Not Availabe,819,1264,,
11/19/2018 11:15,"Today we will begin the process of sharing our policies that form my plan to create jobs, restructure the polity, and Get Nigeria Working Again. #TheAtikuPlan",1.06E+18,Twitter for iPhone,atiku,,Not Availabe,Not Availabe,Not Availabe,706,1124,,
11/19/2018 11:14,"But above all, my plan will help create jobs because in my many travels across our great nation the one consistent thing I hear wherever I am is that our people need jobs. #TheAtikuPlan",1.06E+18,Twitter for iPhone,atiku,,Not Availabe,Not Availabe,Not Availabe,774,1235,,
11/19/2018 11:14,My plan will invest in our failing infrastructure. #TheAtikuPlan,1.06E+18,Twitter for iPhone,atiku,,Not Availabe,Not Availabe,Not Availabe,679,1056,,
11/19/2018 11:12,"My plan will cater for the elderly, so our people are not afraid of growing old. #TheAtikuPlan",1.06E+18,Twitter for iPhone,atiku,,Not Availabe,Not Availabe,Not Availabe,749,1176,,
11/19/2018 11:12,"My plan will empower Nigerian women, reduce maternal mortality and increase their financial stability. #TheAtikuPlan",1.06E+18,Twitter for iPhone,atiku,,Not Availabe,Not Availabe,Not Availabe,733,1197,,
11/19/2018 11:11,My plan will give Nigeria’s youth a world-class education. #TheAtikuPlan,1.06E+18,Twitter for iPhone,atiku,,Not Availabe,Not Availabe,Not Availabe,816,1315,,
11/19/2018 11:11,My plan will give Nigerian workers a living wage. #TheAtikuPlan,1.06E+18,Twitter for iPhone,atiku,,Not Availabe,Not Availabe,Not Availabe,752,1206,,
11/19/2018 11:10,"That plan worked and today I have the pleasure of unveiling our policies and strategies to take Nigeria from where she is now, to where she needs to be. #TheAtikuPlan",1.06E+18,Twitter for iPhone,atiku,,Not Availabe,Not Availabe,Not Availabe,682,1122,,
11/19/2018 11:09,"We also introduced the GSM revolution that saw Nigeria go from 100,000 phone lines to over 100 million today. We were able to achieve these, and much more, because we had a plan. #TheAtikuPlan",1.06E+18,Twitter for iPhone,atiku,,Not Availabe,Not Availabe,Not Availabe,869,1398,,
11/19/2018 11:09,"Despite the fact that crude oil prices at that time were much lower than they are today, under the dynamic leadership of President Olusegun Obasanjo, we paid off Nigeria’s entire foreign debt. #TheAtikuPlan",1.06E+18,Twitter for iPhone,atiku,,Not Availabe,Not Availabe,Not Availabe,901,1422,,
11/19/2018 11:09,"I was Vice President of the Federal Republic of Nigeria from 1999 to 2007 and in that time, I chaired the National Economic Council that gave Nigeria her highest and most consistent GDP growth of over 6% per annum. #TheAtikuPlan",1.06E+18,Twitter for iPhone,atiku,,Not Availabe,Not Availabe,Not Availabe,884,1308,,
11/19/2018 11:08,I am not talking about what I can do. I am talking of what I have done before. #TheAtikuPlan,1.06E+18,Twitter for iPhone,atiku,,Not Availabe,Not Availabe,Not Availabe,903,1509,,
11/19/2018 11:07,"Over the last 18 months, I have worked with the best experts Nigeria has to offer to come up with policies and plans that when implemented will get Nigeria going in the right direction again. #TheAtikuPlan",1.06E+18,Twitter for iPhone,atiku,,Not Availabe,Not Availabe,Not Availabe,775,1233,,
11/19/2018 11:07,"As the International Monetary Fund stated very recently, it is the failure of this government to have a coherent and comprehensive set of policies combined with poor leadership that has led to its failure to deliver. #TheAtikuPlan",1.06E+18,Twitter for iPhone,atiku,,Not Availabe,Not Availabe,Not Availabe,781,1104,,
11/19/2018 11:06,A promise is an indication to do a future action. A policy is a plan to achieve future goals. #TheAtikuPlan,1.06E+18,Twitter for iPhone,atiku,,Not Availabe,Not Availabe,Not Availabe,1014,1629,,
11/19/2018 11:05,"I am not one for making grandiose promises. Rather than promises, I believe in policies. #TheAtikuPlan",1.06E+18,Twitter for iPhone,atiku,,Not Availabe,Not Availabe,Not Availabe,777,1215,,
11/19/2018 11:04,"Too often, Nigerians have been promised better governance by those seeking their votes. Such individuals have preyed on the legitimate desires of our people for their conditions to be improved, that they make all sorts of promises. #TheAtikuPlan",1.06E+18,Twitter for iPhone,atiku,,Not Availabe,Not Availabe,Not Availabe,728,1136,,
11/19/2018 11:03,"Atiku Abubakar is 100% for 100% of Nigerians, 100% of the time. #TheAtikuPlan",1.06E+18,Twitter for iPhone,atiku,,Not Availabe,Not Availabe,Not Availabe,925,1399,,
11/19/2018 11:03,I am strongly of the view that I am just one Nigerian and one Nigerian cannot be as wise as all Nigerians. That is why I will offer an inclusive leadership. #TheAtikuPlan,1.06E+18,Twitter for iPhone,atiku,,Not Availabe,Not Availabe,Not Availabe,866,1344,,
11/19/2018 11:02,The most important question in this election is: “Are you better off than you were four years ago?  Are we richer or poorer?”  That is why our primary focus is on getting Nigeria working again. #TheAtikuPlan,1.06E+18,Twitter for iPhone,atiku,,Not Availabe,Not Availabe,Not Availabe,1069,1672,,
11/19/2018 11:02,"Today, I am formally presenting myself to you as the presidential candidate of not just the @OfficialPDPNig, but of the hopes and aspirations of all Nigerians. #TheAtikuPlan",,Twitter for iPhone,,,Not Availabe,Not Availabe,Not Availabe,3931,9081,,
11/19/2018 11:00,My plan to get Nigeria working again. #TheAtikuPlan #LetsGetNigeriaWorkingAgain https://t.co/gugWYGWTN0,,Periscope,,,Not Availabe,Not Availabe,Not Availabe,5312,8642,,
11/19/2018 10:50,"In 10 minutes, I will be launching my plan to get Nigeria working again. 

Watch live on Facebook and Twitter. 

Join me and share with friends using the hashtag #TheAtikuPlan -AA https://t.co/0k7QeHZiJM",,Twitter for iPhone,,,Not Availabe,Not Availabe,Not Availabe,895,2254,,
11/19/2018 10:05,"If you are watching the launch of our policy, please get a friend to watch with you. 

Share with friends and family. Remember to engage with the hashtag #TheAtikuPlan https://t.co/qhPPLb5dgX",,Twitter for iPhone,,,Not Availabe,Not Availabe,Not Availabe,2346,5482,,
11/19/2018 5:59,#TheAtikuPlan will be unveiled today. Are you excited?,,Twitter for iPhone,,,Not Availabe,Not Availabe,Not Availabe,3754,13141,,
11/18/2018 10:15,"Join me at 12 noon, 19th November as we unveil our plan to Nigerians on Facebook and twitter. 

You can share feedback and questions using the hashtag #TheAtikuPlan https://t.co/T3tZS9SER4",,Twitter for iPhone,,,Not Availabe,Not Availabe,Not Availabe,4132,9761,,
11/17/2018 19:55,"On my way to Yola, preparing for our policy launch on Monday #TheAtikuPlan https://t.co/MhbfMe3pND",,Twitter for iPhone,,,Not Availabe,Not Availabe,Not Availabe,3275,13029,,
11/17/2018 15:18,Congratulations @NGSuperEagles on qualifying for the 2019 #AFCON. We will be here to cheer you to victory in the coming tournament. https://t.co/S7W9vsWaLn,,Twitter for iPhone,,,1.06381E+18,Not Availabe,Not Availabe,1463,5247,,
11/15/2018 7:00,"“I will make Nigeria work again” - my interview with @TheAfricaReport. 

https://t.co/vQuTaGO3us https://t.co/v6wBylXnpi",,Twitter for iPhone,,,Not Availabe,Not Availabe,Not Availabe,2187,5456,,
11/14/2018 19:30,"Professor Ben Nwabueze is a patriot and Nigeria’s foremost constitutional lawyer. In a very emotional meeting in Enugu, he reminded me of the unfinished Nigerian Project.

I assure him, and every Nigerian, that I'll keep my word. #AtikuInEnugu https://t.co/lXR4fL959z",,Twitter for iPhone,,,Not Availabe,Not Availabe,Not Availabe,2758,8520,,
11/14/2018 17:21,"RT @PeterGregoryObi: If officials can’t collect cash and levies are made transparent, it would be much more difficult to shake people down.…",,Twitter for iPhone,,,Not Availabe,Not Availabe,Not Availabe,545,0,,
11/14/2018 17:21,"RT @PeterGregoryObi: Harassment affects our image and ability to attract investment. 

We also plan to introduce electronic records and pay…",,Twitter for iPhone,,,Not Availabe,Not Availabe,Not Availabe,646,0,,
11/14/2018 17:21,"RT @PeterGregoryObi: Hello Kemi. Congratulations on your blockbuster film, #KingOfBoys. 

I’m sorry you went through that experience. I agr…",,Twitter for iPhone,,,1.06264E+18,Not Availabe,Not Availabe,1174,0,,
11/12/2018 14:09,The events in Paris this weekend commemorating the armistice bringing peace after WWI reminds us that peace is necessary for the freedom to be all that we can be. We should strive to do the much we can from our little corners to enthrone peace to #GetNigeriaWorkingAgain,,Twitter for iPhone,,,Not Availabe,Not Availabe,Not Availabe,1522,5580,,
11/11/2018 14:53,"I arrived to Abuja this morning to a search by agents of the state, aimed at intimidating me and my staff.

I am committed to building a Nigeria where no citizen is intimidated by agents of state who are paid to protect them. 

Together, #LetsGetNigeriaWorkingAgain.",,Twitter for iPhone,,,Not Availabe,Not Availabe,Not Availabe,6226,14426,,
11/9/2018 17:42,I will leave that to @PeterGregoryObi. He’s an excellent manager of lean resources #smile https://t.co/o71veu82CL,,Twitter for iPhone,,,1.06047E+18,Not Availabe,Not Availabe,2437,5073,,
11/9/2018 15:12,RT @PeterGregoryObi: Our focus in the @Atiku team is getting Nigeria working again. Join us on this journey. Speak to friend and neighbours…,,Twitter for iPhone,,,Not Availabe,Not Availabe,Not Availabe,858,0,,
11/9/2018 15:12,"RT @PeterGregoryObi: From all indicators, our economy is failing. This is why the APC is talking about everything but the economy. Our peop…",,Twitter for iPhone,,,Not Availabe,Not Availabe,Not Availabe,2243,0,,
11/9/2018 7:47,"The most important question in this election is ‘Are you better off today than you were 4 years ago?’ Are we richer or poorer?

This is why our primary focus is on getting Nigeria working again.",,Twitter for iPhone,,,Not Availabe,Not Availabe,Not Availabe,6114,15632,,
11/8/2018 9:02,"RT @PeterGregoryObi: It was my pleasure meeting with Prince Charles at the residence of the British High Commissioner to Nigeria, Paul Arkw…",,Twitter for iPhone,,,Not Availabe,Not Availabe,Not Availabe,1185,0,,
11/7/2018 17:26,"RT @SpokesManAtiku: Reports in the media that @atiku hosted a 400 person meeting in Dubai are false. For the avoidance of doubt, ours was n…",,Twitter for iPhone,,,Not Availabe,Not Availabe,Not Availabe,885,0,,
11/6/2018 20:53,"RT @bukolasaraki: As we prepare to show Nigerians our party’s vision for the future, this evening, I inspected Legacy House, the office bui…",,Twitter for iPhone,,,Not Availabe,Not Availabe,Not Availabe,1581,0,,
11/4/2018 9:07,"I'm inspired by the spirit of the Special Eagles to break new ground. You are truly special. 

https://t.co/fkbD9gMe9R",,Twitter for iPhone,,,Not Availabe,Not Availabe,Not Availabe,697,3175,,
11/3/2018 20:19,"Deeply saddened by the loss of these young lives. I pray for comfort for their families.

https://t.co/mDFac7TFiI",,Twitter for iPhone,,,Not Availabe,Not Availabe,Not Availabe,562,1962,,
11/3/2018 13:09,"Always a sad day for our country when such entities pack up. FDI is a key component to economic growth. My administration will attract more FDI by making the CBN stronger and independent, banish multiple exchange rates and promote market-led economy. 
https://t.co/cKu6KsmRQO",,Twitter for iPhone,,,Not Availabe,Not Availabe,Not Availabe,2876,6405,,
10/31/2018 9:55,"I am super excited that Nigeria’s Special Eagles, against all odds, recorded their first victory in their maiden World Cup outing in Mexico. It is my hope that with greater support, they can only get better and soar like the Eagles they are.
https://t.co/C1qkBl6tG3",,Twitter for iPhone,,,Not Availabe,Not Availabe,Not Availabe,1566,6050,,
10/28/2018 17:54,"The passing away of Chief Tony Anenih, one of the founding fathers and elder statesmen of @OfficialPDPNig is a sad news to me and everyone who had a close &amp; personal relationship with him. I pray for strength and comfort for his family. May God grant his soul a peaceful repose.",,Twitter for iPhone,,,Not Availabe,Not Availabe,Not Availabe,1629,5855,,
10/28/2018 11:14,"Dear Ningi,

I appreciate your support and all young Nigerians who are getting Atikulated across the country. Our official support channels will be opened as soon as INEC permits us. 

Until then, speak to your neighbours to speak to their neighbours. #LetsGetNigeriaWorkingAgain https://t.co/tuqUYdgIid",,Twitter for iPhone,,,1.0562E+18,Not Availabe,Not Availabe,1619,4724,,
10/28/2018 11:11,"What is his name? Please extend my thanks. #LetsGetNigeriaWorkingAgain, together! https://t.co/rcD0aZgMBM",,Twitter for iPhone,,,1.05631E+18,Not Availabe,Not Availabe,536,2067,,
10/28/2018 11:07,"Dear Anieze,

Thank you for the art. I believe, like you, most young Nigerians want a country that allows them express themselves and succeed in whatever profession they choose. 

I also hope you have permission to paint on that wall #smile https://t.co/Q5GQrg3FU2",,Twitter for iPhone,,,1.05631E+18,Not Availabe,Not Availabe,3284,9669,,
10/27/2018 14:37,"Today, I celebrate Dr Stella Adadevoh, a true Nigerian hero. 

I am happy Google, and indeed the world is honouring her today, but we will do her greater honour by ensuring that we improve workplace safety for medical practitioners and all workers https://t.co/RbpEJM2IcJ",,Twitter for iPhone,,,Not Availabe,Not Availabe,Not Availabe,3010,8303,,
10/26/2018 17:55,We thank @TheEconomist for their endorsement of our #LetsGetNigeriaWorkingAgain policies. https://t.co/cSffY8Kaj8,,Twitter for iPhone,,,Not Availabe,Not Availabe,Not Availabe,2835,7233,,
10/26/2018 11:21,Reviewing the final text of the #LetsGetNigeriaWorkingAgain policy document to be presented to Nigerians. https://t.co/EFlrvepkci,,Twitter for iPhone,,,Not Availabe,Not Availabe,Not Availabe,4432,12397,,
10/25/2018 16:38,"Thank you, Segun. Wishing the team all the best. https://t.co/aI9KdmnAzD",,Twitter for iPhone,,,1.05542E+18,Not Availabe,Not Availabe,1122,3698,,
10/25/2018 14:59,"In my private enterprises, I have shown commitment to the goose that lays the golden egg, and if given the opportunity, I shall extend that commitment to the public sector.",1.06E+18,Twitter for iPhone,atiku,,Not Availabe,Not Availabe,Not Availabe,996,3192,,
10/25/2018 14:59,"I want the Nigerian Labour Congress, the Trade Union Congress and the generality of Nigeria’s workers to be assured of my commitment to the principle of a living wage for Nigeria’s workers.",,Twitter for iPhone,,,Not Availabe,Not Availabe,Not Availabe,2450,7312,,
10/25/2018 7:31,RT @PeterGregoryObi: Thank you all for the welcome. #LetsGetNigeriaWorkingAgain,,Twitter for iPhone,,,Not Availabe,Not Availabe,Not Availabe,783,0,,
10/24/2018 18:08,"Earlier today, @PeterGregoryObi met with the representatives of the @EUinNigeria and @WEF. #LetsGetNigeriaWorkingAgain https://t.co/5VBIb0heqs",,Twitter for iPhone,,,Not Availabe,Not Availabe,Not Availabe,1427,5165,,
10/23/2018 18:21,Just arrived Dubai for business meetings and my children put up a heartwarming surprise. https://t.co/mwmnbMqqlp,,Twitter for iPhone,,,Not Availabe,Not Availabe,Not Availabe,2109,10082,,
10/23/2018 11:03,"Thank you Elijah, truly appreciated. https://t.co/1uAzayUzSL",,Twitter for iPhone,,,1.05469E+18,Not Availabe,Not Availabe,827,2943,,
10/23/2018 6:16,RT @SpokesManAtiku: It is better to sing about your achievements (if they exist) than to sing slander against opponents. Atiku's message to…,,Twitter for iPhone,,,Not Availabe,Not Availabe,Not Availabe,1117,0,,
10/22/2018 6:46,"We will promote a policy of commercial agriculture and encourage cooperative societies among farmers to aggregate input and outputs, to make them wealthier.

#LetsGetNigeriaWorkingAgain",1.05E+18,Twitter for iPhone,atiku,,Not Availabe,Not Availabe,Not Availabe,1313,3856,,
10/22/2018 6:27,"Good morning Nigeria. 
Let us remember to speak to everyone about the task we have in this election - to replace a government that has lost over 6 million jobs with one that will create new jobs. https://t.co/OEWEGzZ1TM",,Twitter for iPhone,,,Not Availabe,Not Availabe,Not Availabe,4498,12449,,
